Northeast Film Studio,1949,qiao
Northeast Film Studio,1949,hui dao zi ji dui wu lai
Northeast Film Studio,1949,guang mang wan zhang
Northeast Film Studio,1949,zhong hua nv er
Northeast Film Studio,1949,bai yi zhan shi
Northeast Film Studio,1949,wu xing de zhan xian
Wenhua Film Company,1949,biao
Datong Film Company,1949,er bai wu xiao zhuan
Kunlun Film Company,1949,wu ya yu ma que
Kunlun Film Company,1949,san mao liu lang ji
新时代影业公司 (Hong Kong),1949,ye lai feng yu sheng
中企影艺社,1949,sen lin da xue an
中企影艺社,1949,han shan si zhong sheng
华光影业制片厂,1949,nian nian ru yi
嘉年影业公司,1949,tong xin jie
嘉年影业公司,1949,e ren xing
华侨影业公司 (Hong Kong),1949,ren zai wu yan xia
新中华影业公司,1949,tai ping qiao de nu chao
远东影业公司,1949,da lei yu
Datong Film Company,1949,huan tian xi di
Datong Film Company,1949,die lian hua
Datong Film Company,1949,wang chuan qiu shui
Datong Film Company,1949,shi qu de ai qing
Guotai Film Company,1949,yi xiang tian kai
嘉华影业公司,1949,nv zei
大华电影企业公司,1949,wan huo de nv ren
Wenhua Film Company,1949,yue ju jing hua
中央电影摄影场一厂,1949,xun meng ji
Guotai Film Company,1949,shi er xiao shi de qi ji
中央电影摄影场二厂,1949,xi ying chun
Kunlun Film Company,1949,xi wang zai ren jian
Northeast Film Studio,1950,zhao yi man
Northeast Film Studio,1950,guang rong ren jia
Northeast Film Studio,1950,wei guo bao jia
Northeast Film Studio,1950,hong qi ge
Northeast Film Studio,1950,gang tie zhan shi
Northeast Film Studio,1950,gao ge meng jin
Northeast Film Studio,1950,liu hu lan
Northeast Film Studio,1950,liao yuan de xiang cun
Northeast Film Studio,1950,nei meng ren min de sheng li
Northeast Film Studio,1950,bai mao nv
Northeast Film Studio,1950,ren min de zhan shi
Northeast Film Studio,1950,bao wei sheng li guo shi
Northeast Film Studio,1950,zai qian jin de dao lu shang
Beijing Film Studio,1950,lv liang ying xiong
Beijing Film Studio,1950,gui shen bu ling
Beijing Film Studio,1950,min zhu qing nian jin xing qu
Beijing Film Studio,1950,er nv qin shi
Beijing Film Studio,1950,he ping bao wei zhe
Shanghai Film Studio,1950,nong jia le
Shanghai Film Studio,1950,da di chong guang
Kunlun Film Company,1950,ren min de ju zhang
Kunlun Film Company,1950,wu xun zhuan (shang ji)
Kunlun Film Company,1950,wu xun zhuan (xia ji)
Wenhua Film Company,1950,tai ping chun
Wenhua Film Company,1950,si xiang wen ti
Wenhua Film Company,1950,wo zhe yi bei zi
Wenhua Film Company,1950,fu shi (1950)
嘉年影业公司,1950,ren shou zhi jian
黎明影业公司,1950,nv da heng
Da Guangming Film Company,1950,huan nan fu qi
Guotai Film Company,1950,huan nan fu qi
惠昌商务有限公司,1950,hun yan da shi
Da Guangming Film Company,1950,san bai liu shi hang
Guotai Film Company,1950,san bai liu shi hang
东华影业公司,1950,shuo huang de zhang fu
中国五彩电影实验工场,1950,shi liu hong
雷电影业公司,1950,ye ying qu
Datong Film Company,1950,ying mi zhuan
Datong Film Company,1950,zi you tian di
Guotai Film Company,1950,tai tai wen ti
Guotai Film Company,1950,sheng ming jiao xiang qu
Northeast Film Studio,1951,gui hua
Beijing Film Studio,1951,xin er nv ying xiong zhuan
Beijing Film Studio,1951,shan bei mu ge
Beijing Film Studio,1951,zou xiang xin zhong guo
Shanghai Film Studio,1951,nv si ji
Shanghai Film Studio,1951,tuan jie qi lai dao ming tian
Shanghai Film Studio,1951,sheng li chong feng
Shanghai Film Studio,1951,shang rao ji zhong ying
Shanghai Film Studio,1951,hai shang feng bao
Shanghai Film Studio,1951,cui gang hong qi
Changjiang Film Studio,1951,liang jia chun
Guotai Film Company,1951,hong lou er you
Kunlun Film Company,1951,wo men fu fu zhi jian
Wenhua Film Company,1951,jie jie mei mei zhan qi lai
Wenhua Film Company,1951,guan lian zhang
Datong Film Company,1951,cai feng shuang fei
Wenhua Film Company,1951,you yi jia ren jia
Datong Film Company,1951,nv er chun
新中华影业公司,1951,jiang cun you xia zhuan
新中华影业公司,1951,da jia huan xi
东华影业公司,1951,yin yang jie
中国五彩电影实验工场,1951,zhi bu guo shi ai qing
Northeast Film Studio,1952,pu tao shu le de shi hou
Northeast Film Studio,1952,liu hao men
Beijing Film Studio,1952,yi guan hai ren dao
Beijing Film Studio,1952,long xu gou
Shanghai Film Studio,1952,nan zheng bei zhan
Wenhua Film Company,1952,mei guo zhi chuang
Da Guangming Film Company,1952,fang zhen zhu
Changjiang-Kunlun Associated Film Studio,1952,lao dong hua kai
Da Guangming Film Company,1952,shi li chuan jia
Northeast Film Studio,1953,feng shou
Northeast Film Studio,1953,cao yuan shang de ren men
Northeast Film Studio,1953,jie hun
Northeast Film Studio,1953,xiao gu xian
Beijing Film Studio,1953,zhi qu hua shan
Beijing Film Studio,1953,zhao xiao lan
Shanghai Film Studio,1953,jin yin tan
Changjiang-Kunlun Associated Film Studio,1953,fang hua qu
Changjiang-Kunlun Associated Film Studio,1953,wei hai zi men zhu fu
Wenhua Film Company,1953,tai yang zhao liang le hong shi gou
Northeast Film Studio,1954,ying xiong si ji
Northeast Film Studio,1954,chun feng chui dao nuo min he
Northeast Film Studio,1954,sha jia dian liang zhan
Northeast Film Studio,1954,tu di
Northeast Film Studio,1954,wu qiong de qian li
Northeast Film Studio,1954,ren wang gao chu zou
Northeast Film Studio,1954,yu zhou feng
Northeast Film Studio,1954,shi yu zhuo
Beijing Film Studio,1954,xiao bai tu
Beijing Film Studio,1954,yi jian ti an
Shanghai Film Studio,1954,ji mao xin
Shanghai Film Studio,1954,zhan duan mo zhua
Shanghai Film Studio,1954,san nian
Shanghai Film Studio,1954,wei da de qi dian
Shanghai Film Studio,1954,du jiang zhen cha ji
Shanghai Film Studio,1954,huai shang ren jia
Shanghai Film Studio,1954,shan jian ling xiang ma bang lai
Shanghai Film Studio,1954,yi chang feng bo
Shanghai Film Studio,1954,bu neng zou na tiao lu
Shanghai Film Studio,1954,fu nv dai biao
Shanghai Film Studio,1954,liang shan bo yu zhu ying tai
Shanghai Film Studio,1954,shuang tui mo
Shanghai Film Studio,1954,lan qiao hui
Shandong Film Studio,1954,gai jiao tian de wu tai yi shu
Central Newsreel and Documentary Film Studio,1954,chuan ju ji jin
Changchun Film Studio,1955,zu guo de hua duo
Changchun Film Studio,1955,meng he de li ming
Changchun Film Studio,1955,xia tian de gu shi
Changchun Film Studio,1955,shen mi de lv ban
Changchun Film Studio,1955,ping yuan you ji dui
Changchun Film Studio,1955,luo xiao lin de jue xin
Changchun Film Studio,1955,dong cun rui
Changchun Film Studio,1955,nu hai qing qi
Changchun Film Studio,1955,qin xiang lian
Changchun Film Studio,1955,da jin zhi
Beijing Film Studio,1955,mei lan fang de wu tai yi shu (shang ji)
Shanghai Film Studio,1955,ha sen yu jia mi la
Shanghai Film Studio,1955,tian luo di wang
Shanghai Film Studio,1955,shui xiang de chun tian
Shanghai Film Studio,1955,qing chun de yuan di
Shanghai Film Studio,1955,hu shang de dou zheng
Shanghai Film Studio,1955,min jiang ju zi hong
Shanghai Film Studio,1955,nan dao feng yun
Shanghai Film Studio,1955,song jing shi
Shanghai Film Studio,1955,shang jin shan
Shanghai Film Studio,1955,guang chang za ji biao yan
Shanghai Film Studio,1955,lian yin
Shanghai Film Studio,1955,tian xian pei
August First Film Studio,1955,jiao yin
Central Newsreel and Documentary Film Studio,1955,huang he da he chang
Changchun Film Studio,1956,hu xue zhui zong
Changchun Film Studio,1956,pu bu mie de huo yan
Changchun Film Studio,1956,xin ju zhang dao lai zhi qian
Changchun Film Studio,1956,ma lan hua kai
Changchun Film Studio,1956,ge ge he mei mei
Changchun Film Studio,1956,ma
Changchun Film Studio,1956,guan bu zhu
Changchun Film Studio,1956,ma ma yao wo chu jia
Changchun Film Studio,1956,pi bao
Changchun Film Studio,1956,bu ju xiao jie de ren
Changchun Film Studio,1956,ru ci duo qing
Changchun Film Studio,1956,guo qing shi dian zhong
Changchun Film Studio,1956,shang gan ling
Changchun Film Studio,1956,liu qiao er
Changchun Film Studio,1956,hua mu lan
Beijing Film Studio,1956,mei lan fang de wu tai yi shu (xia ji)
Beijing Film Studio,1956,luo shen
Beijing Film Studio,1956,huang shan lei
Beijing Film Studio,1956,zhu fu
Shanghai Film Studio,1956,wei le he ping
Shanghai Film Studio,1956,chun tian lai le
Shanghai Film Studio,1956,qiu weng yu xian ji
Shanghai Film Studio,1956,xiao bai qi de feng bo
Shanghai Film Studio,1956,shei shi xiong shou
Shanghai Film Studio,1956,mu qin
Shanghai Film Studio,1956,luo shui ji
Shanghai Film Studio,1956,xiao huo ban
Shanghai Film Studio,1956,li shi zhen
Shanghai Film Studio,1956,liang ge xiao zu qiu dui
Shanghai Film Studio,1956,tie dao you ji dui
Shanghai Film Studio,1956,jia
Shanghai Film Studio,1956,sha mo li de zhan dou
Shanghai Film Studio,1956,sou shu yuan
Shanghai Film Studio,1956,shi wu guan
Shanghai Film Studio,1956,song shi jie
Shanghai Film Studio,1956,an tang xiang hui
Shanghai Film Studio,1956,zhou xin fang de yi shu sheng huo
Shanghai Film Studio,1956,an tang ren mu
Shanghai Film Studio,1956,ge ma
August First Film Studio,1956,chong po li ming qian de hei an
August First Film Studio,1956,zhei jue bu shi xiao shi qing
Central Newsreel and Documentary Film Studio,1956,you yuan jing meng (1956)
Central Newsreel and Documentary Film Studio,1956,huang hua ling
Changchun Film Studio,1957,bao feng yu zhong de xiong ying
Changchun Film Studio,1957,ji jing de shan lin
Changchun Film Studio,1957,wei wan cheng de xi ju
Changchun Film Studio,1957,fu shi (1957)
Changchun Film Studio,1957,qing chun de jiao bu
Changchun Film Studio,1957,xun ai ji
Changchun Film Studio,1957,di xia jian bing
Changchun Film Studio,1957,lu sheng lian ge
Changchun Film Studio,1957,bian zhai feng huo
Changchun Film Studio,1957,mu nv jiao shi
Changchun Film Studio,1957,mu ren zhi zi
Changchun Film Studio,1957,li er sao gai jia
Changchun Film Studio,1957,hu die bei
Changchun Film Studio,1957,jie nian
Beijing Film Studio,1957,qun ying hui
Beijing Film Studio,1957,jie dong feng
Beijing Film Studio,1957,du shi niang
Beijing Film Studio,1957,yan dang shan
Haiyan Film Studio,1957,yang cheng an shao
Haiyan Film Studio,1957,dong xiao heng chui
Haiyan Film Studio,1957,qiu chang feng bo
Haiyan Film Studio,1957,hai hun
Haiyan Film Studio,1957,mu tong tou jun
Tianma Film Studio,1957,ye lin qu
Tianma Film Studio,1957,qing chang yi shen
Tianma Film Studio,1957,nv lan 5 hao
Tianma Film Studio,1957,wu hai ye hang
Tianma Film Studio,1957,xing fu
Tianma Film Studio,1957,bai yue ji
Tianma Film Studio,1957,chen san wu niang
Jiangnan Film Studio,1957,luo han qian
Jiangnan Film Studio,1957,a fu xun bao ji
Jiangnan Film Studio,1957,feng huang zhi ge
Jiangnan Film Studio,1957,hu shi ri ji
Jiangnan Film Studio,1957,cheng feng po lang
Jiangnan Film Studio,1957,bu ye cheng
August First Film Studio,1957,zhan dou li cheng zhang
August First Film Studio,1957,shui
August First Film Studio,1957,liu bao de gu shi
August First Film Studio,1957,wu geng han
August First Film Studio,1957,ji zhan qian ye
Studio of Beijing Film Academy,1957,chuan shan ju long
Studio of Beijing Film Academy,1957,da mu jiang
Changchun Film Studio,1958,hua hao yue yuan
Changchun Film Studio,1958,min bing de er zi
Changchun Film Studio,1958,hong hai zi
Changchun Film Studio,1958,shui ku shang de ge sheng
Changchun Film Studio,1958,dang de nv er
Changchun Film Studio,1958,xu qiu ying an jian
Changchun Film Studio,1958,xuan ya
Changchun Film Studio,1958,gu cha zhong sheng
Changchun Film Studio,1958,ta ai shang le gu xiang
Changchun Film Studio,1958,gong di qing nian
Changchun Film Studio,1958,nv she zhang
Changchun Film Studio,1958,li ming de he bian
Changchun Film Studio,1958,dong feng
Changchun Film Studio,1958,xin lian xin
Changchun Film Studio,1958,huan nan zhi jiao
Changchun Film Studio,1958,san nian zao zhi dao
Changchun Film Studio,1958,bing jian qian jin
Changchun Film Studio,1958,bai shou qi jia
Changchun Film Studio,1958,hua zhong ren
Changchun Film Studio,1958,lie bing deng zhi gao
Changchun Film Studio,1958,xin de yi ke
Changchun Film Studio,1958,fu wu yuan
Changchun Film Studio,1958,shuai qi piao piao
Changchun Film Studio,1958,chun shui chang liu
Changchun Film Studio,1958,shang ba de gu shi
Lanzhou Film Studio,1958,kuai ma jia bian
Changchun Film Studio,1958,kuai ma jia bian
Changchun Film Studio,1958,hong ling jin de gu shi
Changchun Film Studio,1958,tian xia wu nan shi
Changchun Film Studio,1958,chun lei (1958)
Changchun Film Studio,1958,bao shan zhi ge
Changchun Film Studio,1958,huo yan ju
Beijing Film Studio,1958,feng zheng
Garance Productions (France),1958,feng zheng
Beijing Film Studio,1958,shang hai gu niang
Beijing Film Studio,1958,sheng huo de lang hua
Beijing Film Studio,1958,tan qin ji
Beijing Film Studio,1958,shi san ling shui ku chang xiang qu
Beijing Film Studio,1958,shan li de ren
Beijing Film Studio,1958,yi tian yi ye
Beijing Film Studio,1958,liu hu xin song
Anhui Film Studio,1958,liu hu xin song
Haiyan Film Studio,1958,ping fan de shi ye
Haiyan Film Studio,1958,ye zou luo tuo ling
Haiyan Film Studio,1958,hong se de zhong zi
Jiangsu Film Studio,1958,hong se de zhong zi
Haiyan Film Studio,1958,shen shan li de ju hua
Haiyan Film Studio,1958,xiao kang ren jia
Haiyan Film Studio,1958,zhan dou de shan cun
Haiyan Film Studio,1958,cui gu zhong sheng
Haiyan Film Studio,1958,cong ming de ren
Haiyan Film Studio,1958,shei shi bei pao qi de ren
Haiyan Film Studio,1958,di san ci shi yan
Haiyan Film Studio,1958,gang ren tie ma
Haiyan Film Studio,1958,ju lang
Haiyan Film Studio,1958,you chuan huo yan
Haiyan Film Studio,1958,dian xing bao gao
Haiyan Film Studio,1958,chang qing shu
Haiyan Film Studio,1958,wang jiang ting
Haiyan Film Studio,1958,xia xiang yu gan jiao
Tianma Film Studio,1958,lan lan he dong dong
Tianma Film Studio,1958,san mao xue sheng yi
Tianma Film Studio,1958,tie chuang lie huo
Tianma Film Studio,1958,da yue jin zhong de xiao zhu ren
Tianma Film Studio,1958,qian fang lai xin
Tianma Film Studio,1958,bu gu niao you jiao le
Tianma Film Studio,1958,qian nv nao hai
Tianma Film Studio,1958,da feng lang li de xiao gu shi
Tianma Film Studio,1958,huang bao mei
Tianma Film Studio,1958,20 tian ge ge ming
Tianma Film Studio,1958,ying xiong gan pai ke
Tianma Film Studio,1958,zhong yao de yi ke
Tianma Film Studio,1958,liang ge ying ye yuan
Tianma Film Studio,1958,gang hua bian di kai
Tianma Film Studio,1958,ni zhui wo gan
Tianma Film Studio,1958,hai shang hong qi
Tianma Film Studio,1958,xin an jiang shang
Tianma Film Studio,1958,zhen zhu ji
Tianma Film Studio,1958,liu jie mei
Jiangnan Film Studio,1958,lin chong
Jiangnan Film Studio,1958,liang ge xun luo bing
Jiangnan Film Studio,1958,miao jia er nv
Jiangnan Film Studio,1958,wu ming ying xiong
Jiangnan Film Studio,1958,lu ban de chuan shuo
Jiangnan Film Studio,1958,san ba he bian
Jiangnan Film Studio,1958,ai chang ru jia
Jiangnan Film Studio,1958,di yi lie kuai che
Jiangnan Film Studio,1958,xiao fang zhi ge
Jiangnan Film Studio,1958,wo long hu
Jiangnan Film Studio,1958,tie shu hua kai
Jiangnan Film Studio,1958,gang cheng hu jiang
Jiangnan Film Studio,1958,re lang ben teng
Jiangnan Film Studio,1958,mu gui ying gua shuai (1958)
Jiangnan Film Studio,1958,qing tan
August First Film Studio,1958,san ge zhan you
August First Film Studio,1958,hei shan zu ji zhan
August First Film Studio,1958,chang kong bi yi
August First Film Studio,1958,hong xia
August First Film Studio,1958,ying xiong hu dan
August First Film Studio,1958,du jiang tan xian
August First Film Studio,1958,yi ri qian li
August First Film Studio,1958,yong bu xiao shi de dian bo
August First Film Studio,1958,po chu mi xin
August First Film Studio,1958,fan lao huan tong
August First Film Studio,1958,jin ling zhuan
August First Film Studio,1958,hai kuo tian kong
August First Film Studio,1958,lang ya shan wu zhuang shi
August First Film Studio,1958,xian wei shu ji
August First Film Studio,1958,yang guan da dao
Pearl River Film Studio,1958,jie ban ren
Changchun Film Studio,1959,chuan chang zhui zong
Changchun Film Studio,1959,gang zhu fei che
Changchun Film Studio,1959,kang zhuang da dao
Changchun Film Studio,1959,wo men cun li de nian qing ren (shang ji)
Changchun Film Studio,1959,xi cheng de gu shi
Changchun Film Studio,1959,xiao zhu yan kai
Harbin Film Studio,1959,xiao zhu yan kai
Changchun Film Studio,1959,shi hang
Changchun Film Studio,1959,bing shang jie mei
Changchun Film Studio,1959,jie qin pei
Changchun Film Studio,1959,wu duo jin hua
Changchun Film Studio,1959,feng cong dong fang lai
Moscow Film Studio,1959,feng cong dong fang lai
Changchun Film Studio,1959,cao yuan chen qu
Inner Mongolia Film Studio,1959,cao yuan chen qu
Changchun Film Studio,1959,huang he fei du
Inner Mongolia Film Studio,1959,huang he fei du
Changchun Film Studio,1959,zhao xia
Changchun Film Studio,1959,yun wu shan zhong
Changchun Film Studio,1959,qing yun qu
Changchun Film Studio,1959,san kan hu die meng
Changchun Film Studio,1959,hai shang shen ying
Changchun Film Studio,1959,dou e yuan
Changchun Film Studio,1959,jin yu ji
Changchun Film Studio,1959,huan le ren jian
Changchun Film Studio,1959,zhan huo zhong de qing chun
Changchun Film Studio,1959,liu shui huan ge
Changchun Film Studio,1959,qian shao
Changchun Film Studio,1959,chen san liang
Changchun Film Studio,1959,shuai jing jia
Beijing Film Studio,1959,lin jia pu zi
Beijing Film Studio,1959,wu ming dao
Beijing Film Studio,1959,kuang deng
Beijing Film Studio,1959,fei yue tian xian
Beijing Film Studio,1959,feng bao
Beijing Film Studio,1959,qing chun zhi ge
Beijing Film Studio,1959,huan tian xi di (1959)
Beijing Film Studio,1959,shui shang chun qiu
Beijing Film Studio,1959,liang shi
Beijing Film Studio,1959,bai feng chao yang
Haiyan Film Studio,1959,san ge mu qin
Haiyan Film Studio,1959,lv zhou kai ge
Xinjiang Film Studio,1959,lv zhou kai ge
Haiyan Film Studio,1959,hao hai zi
Haiyan Film Studio,1959,nie er
Haiyan Film Studio,1959,huang pu jiang de gu shi
Haiyan Film Studio,1959,jin tian wo xiu xi
Haiyan Film Studio,1959,wan zi qian hong zong shi chun
Haiyan Film Studio,1959,xiang hai yang
Haiyan Film Studio,1959,qiao lao ye shang jiao
Haiyan Film Studio,1959,lin ze xu
Haiyan Film Studio,1959,lao bing xin zhuan
Haiyan Film Studio,1959,nv fu ma
Anhui Film Studio,1959,nv fu ma
Haiyan Film Studio,1959,bai sui gua shuai
Haiyan Film Studio,1959,sheng si pai
Hunan Film Studio,1959,sheng si pai
Tianma Film Studio,1959,gang tie shi jia
Tianma Film Studio,1959,chun man ren jian
Tianma Film Studio,1959,sha mo zhui fei ji
Tianma Film Studio,1959,di xia shao xian dui
Tianma Film Studio,1959,xiang piao wan li
Tianma Film Studio,1959,di xia hang xian
Tianma Film Studio,1959,chun feng yang liu
Tianma Film Studio,1959,bao lian deng
Tianma Film Studio,1959,zhui yu
Tianma Film Studio,1959,xing xing zhi huo
Tianma Film Studio,1959,jie ri ge wu
Jiangnan Film Studio,1959,bu lao song
Anhui Film Studio,1959,an hui xi qu ji jin
Jiangnan Film Studio,1959,an hui xi qu ji jin
August First Film Studio,1959,hui min zhi dui
August First Film Studio,1959,jiang shan duo jiao
August First Film Studio,1959,hai ying
August First Film Studio,1959,wan shui qian shan
August First Film Studio,1959,lie huo zhen jin
August First Film Studio,1959,wu duo hong yun
August First Film Studio,1959,ying xiong dao
August First Film Studio,1959,chi feng hao
August First Film Studio,1959,you yi
August First Film Studio,1959,zhan shang hai
Central Newsreel and Documentary Film Studio,1959,mu gui ying gua shuai (1959)
Pearl River Film Studio,1959,yu dao zhi zi
Xi'an Film Studio,1959,xue hai yin shan
Xi'an Film Studio,1959,tian shan ge sheng
Xi'an Film Studio,1959,xian hua duo duo kai
Zhejiang Film Studio,1959,ren xiao zhi da
Shandong Film Studio,1959,gan xiang gan zuo de ren
Wuhan Film Studio,1959,er du mei
Changchun Film Studio,1960,huan hun ji
Changchun Film Studio,1960,hong yan
Changchun Film Studio,1960,tai yang gang gang chu shan
Changchun Film Studio,1960,tuan yuan zhi hou
Changchun Film Studio,1960,kun lun tie ji
Xi'an Film Studio,1960,kun lun tie ji
Changchun Film Studio,1960,zai sheng ji
Changchun Film Studio,1960,tie dao wei shi
Changchun Film Studio,1960,feng huo lie che
Changchun Film Studio,1960,shen yang shou
Changchun Film Studio,1960,shi ji lang
Changchun Film Studio,1960,pan yang song
Changchun Film Studio,1960,liu san jie
Changchun Film Studio,1960,qiang di song
Changchun Film Studio,1960,dong feng di yi zhi
Changchun Film Studio,1960,kong yin he
Changchun Film Studio,1960,wo men shi yi dai ren
Beijing Film Studio,1960,you yuan jing meng (1960)
Beijing Film Studio,1960,wei le liu shi yi ge jie ji di xiong
Beijing Film Studio,1960,yang men nv jiang
Beijing Film Studio,1960,wu cai lu
Beijing Film Studio,1960,yi ge ming de ming yi
Beijing Film Studio,1960,hong hua bian di kai
Beijing Film Studio,1960,chun nuan hua kai
Beijing Film Studio,1960,geng yun bo yu
Beijing Film Studio,1960,hong qi pu
Tianjin Film Studio,1960,hong qi pu
Beijing Film Studio,1960,ge ming jia ting
Haiyan Film Studio,1960,liu shi nian dai di yi chun
Tianma Film Studio,1960,liu shi nian dai di yi chun
Haiyan Film Studio,1960,chuang guan
Haiyan Film Studio,1960,ji liu
Haiyan Film Studio,1960,mian dian wen hua dai biao tuan fang hua yan chu
Haiyan Film Studio,1960,mo ya dai
Haiyan Film Studio,1960,ma lan hua
Haiyan Film Studio,1960,guan han qing
Pearl River Film Studio,1960,guan han qing
Haiyan Film Studio,1960,qin niang mei
Haiyan Film Studio,1960,nv shen
Tianma Film Studio,1960,ta men de xin yuan
Tianma Film Studio,1960,feng liu ren wu shu jin zhao
Haiyan Film Studio,1960,feng liu ren wu shu jin zhao
Tianma Film Studio,1960,xiang yang hua kai
Tianma Film Studio,1960,dou shi ting
Tianma Film Studio,1960,sun wu kong san da bai gu jing
August First Film Studio,1960,hong ying zhan chi
August First Film Studio,1960,shi er ci lie che
August First Film Studio,1960,san ba xian shang
August First Film Studio,1960,ke shan hong ri
August First Film Studio,1960,lin hai xue yuan
August First Film Studio,1960,hong ying
August First Film Studio,1960,meng long sha
August First Film Studio,1960,qi xi
Pearl River Film Studio,1960,ying xiong shi pian
Pearl River Film Studio,1960,xin dui yuan
Pearl River Film Studio,1960,hui yan dan xin
Xi'an Film Studio,1960,bi kong yin hua
Xi'an Film Studio,1960,yong heng de you yi
Xi'an Film Studio,1960,kang han qu
Xi'an Film Studio,1960,cao yuan feng bao
Qinghai Film Studio,1960,cao yuan feng bao
Xi'an Film Studio,1960,san di xue
Xi'an Film Studio,1960,yi wen qian
Emei Film Studio,1960,jia ling jiang bian
Xinjiang Film Studio,1960,liang dai ren
Wuhan Film Studio,1960,qin ren
Wuhan Film Studio,1960,ge ming feng bao zhan sheng long juan feng
Studio of Beijing Film Academy,1960,fu zi lia
Xinjiang Film Studio,1960,ta men zai zhan dou
Tianjin Film Studio,1960,bei lei chu kai
Changchun Film Studio,1961,ma xi tuan de xin jie mu
Changchun Film Studio,1961,wan mu chun
Changchun Film Studio,1961,jian shui dong liu
Changchun Film Studio,1961,dong mei
Changchun Film Studio,1961,shu jia de li wu
Beijing Film Studio,1961,hong hu chi wei dui
Wuhan Film Studio,1961,hong hu chi wei dui
Beijing Film Studio,1961,bao feng zhou yu
Beijing Film Studio,1961,chun lei (1961)
Beijing Film Studio,1961,bei da huang ren
Haiyan Film Studio,1961,51 hao bing zhan
Haiyan Film Studio,1961,ku mu feng chun
Haiyan Film Studio,1961,man luo hua
Haiyan Film Studio,1961,chun cui tao li
Tianma Film Studio,1961,hong se niang zi jun
Tianma Film Studio,1961,ying xiong xiao ba lu
Tianma Film Studio,1961,xiao dao hui
August First Film Studio,1961,tu po wu jiang
August First Film Studio,1961,bi kong xiong shi
August First Film Studio,1961,hong shan hu
Pearl River Film Studio,1961,li jing ji
Xi'an Film Studio,1961,ba shan hong lang
Xi'an Film Studio,1961,yan an you ji dui
Emei Film Studio,1961,da ji he ta de fu qin
Changchun Film Studio,1961,da ji he ta de fu qin
Xinjiang Film Studio,1961,yuan fang xing huo
Anhui Film Studio,1961,feng xue da bie shan
Anhui Film Studio,1961,kou zhun bei xue
Changchun Film Studio,1962,qi tian qi ye
Xi'an Film Studio,1962,qi tian qi ye
Changchun Film Studio,1962,san guan pai yan
Changchun Film Studio,1962,liu yi chuan shu
Changchun Film Studio,1962,jia wu feng yun
Changchun Film Studio,1962,lu huo zheng hong
Beijing Film Studio,1962,hua er duo duo
Beijing Film Studio,1962,kun lun shan shang yi ke cao
Beijing Film Studio,1962,yang nai wu yu xiao bai cai
Hong Kong Jinsheng Film Company,1962,yang nai wu yu xiao bai cai
Beijing Film Studio,1962,ye zhu lin
Hong Kong Dapeng Film Company,1962,ye zhu lin
Beijing Film Studio,1962,ting zhan yi hou
Beijing Film Studio,1962,a na er han
Xinjiang Film Studio,1962,a na er han
Beijing Film Studio,1962,jin shang tian hua
Haiyan Film Studio,1962,sun an dong ben
Haiyan Film Studio,1962,li shuang shuang
Haiyan Film Studio,1962,hong lou meng
Hong Kong Jinsheng Film Company,1962,hong lou meng
Haiyan Film Studio,1962,bi yu zan
Hong Kong Dapeng Film Company,1962,bi yu zan
Tianma Film Studio,1962,mo shu shi de qi yu
Tianma Film Studio,1962,nv li fa shi
Tianma Film Studio,1962,liao yuan
Tianma Film Studio,1962,da li 、 xiao li he lao li
August First Film Studio,1962,dong jin xu qu
August First Film Studio,1962,ge lia hao
August First Film Studio,1962,huai shu zhuang
August First Film Studio,1962,di lei zhan
August First Film Studio,1962,e er duo si feng bao
August First Film Studio,1962,bi hai dan xin
August First Film Studio,1962,ying xiong tan ke shou
Pearl River Film Studio,1962,han jiang hua si jin
Pearl River Film Studio,1962,nan hai chao (shang ji)
Pearl River Film Studio,1962,qi wang qiu jiang
Hong Kong Hongtu Film Company,1962,qi wang qiu jiang
Pearl River Film Studio,1962,hong ye ti shi
Hong Kong Hongtu Film Company,1962,hong ye ti shi
Xi'an Film Studio,1962,sheng ming de huo hua
Xi'an Film Studio,1962,shang xiao yun wu tai yi shu
Emei Film Studio,1962,qiao tai shou luan dian yuan yang pu
Changchun Film Studio,1963,bing shan shang de lai ke
Changchun Film Studio,1963,hua wei mei
Changchun Film Studio,1963,zi you hou lai ren
Changchun Film Studio,1963,chao yang gou
