Changchun Film Studio,1963,wo men cun li de nian qing ren (xu ji)
Changchun Film Studio,1963,man yi bu man yi
Changchun Film Studio,1963,liang jia ren
Changchun Film Studio,1963,qiang tou ma shang
Changchun Film Studio,1963,bing xue jin da lai
Beijing Film Studio,1963,fen shui chang liu
Beijing Film Studio,1963,hong he ji lang
Beijing Film Studio,1963,zao chun er yue
Beijing Film Studio,1963,xiao bing zhang ga
Beijing Film Studio,1963,chun yan zhan chi
Beijing Film Studio,1963,mu gui ying da zhan hong zhou
Hong Kong Fanhua Film Company,1963,mu gui ying da zhan hong zhou
Haiyan Film Studio,1963,xiong mei tan bao
Haiyan Film Studio,1963,fei dao hua
Haiyan Film Studio,1963,you san jie
Hong Kong Jinsheng Film Company,1963,you san jie
Haiyan Film Studio,1963,ru ci die niang
Haiyan Film Studio,1963,bei guo jiang nan
Haiyan Film Studio,1963,shui shou zhang de gu shi
Haiyan Film Studio,1963,niu lang zhi nv
Hong Kong Dapeng Film Company,1963,niu lang zhi nv
Tianma Film Studio,1963,hong ri
Tianma Film Studio,1963,jin sha jiang pan
Tianma Film Studio,1963,bao hu lu de mi mi
Tianma Film Studio,1963,can hua gu niang
Tianma Film Studio,1963,wu song
Tianma Film Studio,1963,shuang zhu feng
Hong Kong Jinsheng Film Company,1963,shuang zhu feng
Tianma Film Studio,1963,huai yin ji
Hong Kong Changhong Film Company,1963,huai yin ji
Tianma Film Studio,1963,qiu mi
August First Film Studio,1963,ye huo chun feng dou gu cheng
August First Film Studio,1963,nong nu
August First Film Studio,1963,nu chao
August First Film Studio,1963,zhua zhuang ding
August First Film Studio,1963,ge ming li shi ge qu biao yan chang
August First Film Studio,1963,duo yin
Pearl River Film Studio,1963,gen zong zhui ji
Pearl River Film Studio,1963,qi shi er jia fang ke
Hong Kong Hongtu Film Company,1963,qi shi er jia fang ke
Pearl River Film Studio,1963,mao zi pei chuang gong
Hong Kong Hongtu Film Company,1963,mao zi pei chuang gong
Xi'an Film Studio,1963,tao hua shan
Changchun Film Studio,1964,zha mei an
Changchun Film Studio,1964,du li da dui
Changchun Film Studio,1964,bing lin cheng xia
Changchun Film Studio,1964,ying xiong er nv
Changchun Film Studio,1964,hong guan jia
Changchun Film Studio,1964,hao xi fu
Changchun Film Studio,1964,nan hai de zao chen
Changchun Film Studio,1964,nv tiao shui dui yuan
Beijing Film Studio,1964,cai die fen fei
Beijing Film Studio,1964,xiao ling dang
Beijing Film Studio,1964,qing nian lu ban
Beijing Film Studio,1964,xiao er hei jie hun
Beijing Film Studio,1964,qian wan bu yao wang ji
Beijing Film Studio,1964,cao yuan xiong ying
Beijing Film Studio,1964,jian gan he bian
Haiyan Film Studio,1964,qing shan lian
Haiyan Film Studio,1964,a shi ma
Haiyan Film Studio,1964,feng shou zhi hou
Haiyan Film Studio,1964,li shan zi
Haiyan Film Studio,1964,bai qiu en dai fu
August First Film Studio,1964,bai qiu en dai fu
Tianma Film Studio,1964,jia ting wen ti
Tianma Film Studio,1964,ni hong deng xia de shao bing
Tianma Film Studio,1964,xue bei
August First Film Studio,1964,an bian ji lang
August First Film Studio,1964,dai bing de ren
August First Film Studio,1964,lei feng
August First Film Studio,1964,fen shui ling
August First Film Studio,1964,xu ri dong sheng
August First Film Studio,1964,dong feng wan li
Pearl River Film Studio,1964,ni feng qian li
Pearl River Film Studio,1964,liu ming zhu
Hong Kong Hongtu Film Company,1964,liu ming zhu
Xi'an Film Studio,1964,tian shan de hong hua
Beijing Film Studio,1964,tian shan de hong hua
Changchun Film Studio,1965,shan cun kuai ji
Changchun Film Studio,1965,san jin shan cheng
Changchun Film Studio,1965,jing po gu niang
Changchun Film Studio,1965,“te kuai” lie che
Changchun Film Studio,1965,qing song ling
Changchun Film Studio,1965,lu kao
Changchun Film Studio,1965,chuan qiang ji
Changchun Film Studio,1965,bai shan xin ge
Changchun Film Studio,1965,yi ke hong xin
Changchun Film Studio,1965,jin yao chi
Changchun Film Studio,1965,duo duo hong hua xiang tai yang
Changchun Film Studio,1965,jie zhen guo
Beijing Film Studio,1965,lie huo zhong yong sheng
Beijing Film Studio,1965,mei dian xin gong ren
Beijing Film Studio,1965,shan cun jie mei
Beijing Film Studio,1965,hong se bei lou
Beijing Film Studio,1965,long ma jing shen
Beijing Film Studio,1965,hua bei qu ye yu hua ju wu tai yi shu pian (shang ji)
Beijing Film Studio,1965,hua bei qu ye yu hua ju wu tai yi shu pian (xia ji)
Beijing Film Studio,1965,mai niu 、ba gua yuan
Beijing Film Studio,1965,san duo xiao hong hua
Beijing Film Studio,1965,lang tao gun gun
Haiyan Film Studio,1965,xiao zu qiu dui
Haiyan Film Studio,1965,huang sha lv lang
Haiyan Film Studio,1965,hong hua qu
Haiyan Film Studio,1965,nong jia bao 、liang long di
Haiyan Film Studio,1965,zhe shi wo ying gai zuo de
Haiyan Film Studio,1965,gu sao lian wu
Tianma Film Studio,1965,nian qing de yi dai
Tianma Film Studio,1965,gui tai
Tianma Film Studio,1965,wu tai jie mei
Tianma Film Studio,1965,xi qu ji jin
Tianma Film Studio,1965,shang hai zhi chun
Shanghai Animation Film Studio,1965,fu jian gong yi xin hua
Shanghai Animation Film Studio,1965,shang hai shi shao nian er tong ge ming ge wu xuan ji
August First Film Studio,1965,da ji qin lve zhe
August First Film Studio,1965,ku cai hua
August First Film Studio,1965,mi mi tu zhi
August First Film Studio,1965,di dao zhan
August First Film Studio,1965,sheng li zai wang
Anhui Film Studio,1965,ye lin nu huo
August First Film Studio,1965,jun ken zhan ge
August First Film Studio,1965,dong fang hong
Beijing Film Studio,1965,dong fang hong
Central Newsreel and Documentary Film Studio,1965,dong fang hong
Pearl River Film Studio,1965,shuang jiao zi
Pearl River Film Studio,1965,shan cun xin qu
Pearl River Film Studio,1965,da tong luo 、bu guo
Xi'an Film Studio,1965,hong mei ling
Xi'an Film Studio,1965,ren huan ma jiao
Xi'an Film Studio,1965,jun ge liao liang
Changchun Film Studio,1966,ha er bin zhi xia
Changchun Film Studio,1966,yan hong ling xia
Beijing Film Studio,1966,hong se you lu
Beijing Film Studio,1966,nv fei xing yuan
Beijing Film Studio,1966,hong shi zhong sheng
Haiyan Film Studio,1966,ta men zai cheng zhang
Shanghai Animation Film Studio,1966,shang hai gong yi mei shu
August First Film Studio,1966,yi bai ge fang xin
August First Film Studio,1966,qing chun hong si huo
Pearl River Film Studio,1966,you xiang
Pearl River Film Studio,1966,jie niu
Pearl River Film Studio,1966,song liang
Pearl River Film Studio,1966,da lang tao sha
Pearl River Film Studio,1966,yi dai mai zhong
Xi'an Film Studio,1966,lao bao guan 、xin xi fu lai le
Xi'an Film Studio,1966,yi chuan xiang lian