Romanized,Title,Year
qiao,桥,1949
hui dao zi ji dui wu lai,回到自己队伍来,1949
guang mang wan zhang,光芒万丈,1949
zhong hua nv er,中华女儿,1949
bai yi zhan shi,白衣战士,1949
wu xing de zhan xian,无形的战线,1949
biao,表,1949
er bai wu xiao chuan,二百五小传,1949
wu ya yu ma que,乌鸦与麻雀,1949
san mao liu lang ji,三毛流浪记,1949
zhao yi man,赵一曼,1950
guang rong ren jia,光荣人家,1950
wei guo bao jia,卫国保家,1950
hong qi ge,红旗歌,1950
gang tie zhan shi,钢铁战士,1950
gao ge meng jin,高歌猛进,1950
liu hu lan,刘胡兰,1950
liao yuan de xiang cun,辽远的乡村,1950
nei meng ren min de sheng li,内蒙人民的胜利,1950
bai mao nv,白毛女,1950
ren min de zhan shi,人民的战士,1950
bao wei sheng li guo shi,保卫胜利果实,1950
zai qian jin de dao lu shang,在前进的道路上,1950
lv liang ying xiong,吕梁英雄,1950
gui shen bu ling,鬼神不灵,1950
min zhu qing nian jin xing qu,民主青年进行曲,1950
er nv qin shi,儿女亲事,1950
he ping bao wei zhe,和平保卫者,1950
nong jia le,农家乐,1950
da di zhong guang,大地重光,1950
ren min de ju zhang,人民的巨掌,1950
wu xun chuan （shang ji ）,武训传（上集）,1950
wu xun chuan （xia ji ),武训传（下集),1950
da ping chun,大平春,1950
si xiang he ti,思想何题,1950
wo zhei yi bei zi,我这一辈子,1950
fu shi,腐蚀,1950
gui hua,鬼话,1951
xin er nv ying xiong chuan,新儿女英雄传,1951
shan bei mu ge,陕北牧歌,1951
zou xiang xin zhong guo,走向新中国,1951
nv si ji,女司机,1951
tuan jie qi lai dao ming tian,团结起来到明天,1951
sheng li zhong feng,胜利重逢,1951
shang rao ji zhong ying,上饶集中营,1951
hai shang feng bao,海上风暴,1951
cui gang hong qi,翠岗红旗,1951
liang jia chun,两家春,1951
hong lou er you,红楼二尤,1951
wo men fu fu zhi jian,我们夫妇之间,1951
jie jie mei mei zhan qi lai,姐姐妹妹站起来,1951
guan lian zhang,关连长,1951
cai feng shuang fei,彩凤双飞,1951
you yi jia ren jia,有一家人家,1951
pu tao shu le de shi hou,葡萄熟了的时候,1952
liu hao men,六号门,1952
yi guan hai ren dao,一贯害人道,1952
long xu gou,龙须沟,1952
nan zheng bei zhan,南征北战,1952
mei guo zhi chuang,美国之窗,1952
fang zhen zhu,方珍珠,1952
lao dong hua kai,劳动花开,1952
feng shou,丰收,1953
cao yuan shang de ru men,草原上的入们,1953
jie hun,结婚,1953
xiao gu xian,小姑贤,1953
zhi qu hua shan,智取华山,1953
zhao xiao lan,赵小兰,1953
jin yin tan,金银滩,1953
fang hua qu,纺花曲,1953
wei hai zi men zhu fu,为孩子们祝福,1953
tai yang zhao liang le hong shi gou,太阳照亮了红石沟,1953
ying xiong si ji,英雄司机,1954
chun feng chui dao nuo min he,春风吹到诺敏河,1954
sha jia dian liang zhan,沙家店粮站,1954
tu di,土地,1954
wu qiong de qian li,无穷的潜力,1954
ren wang gao chu zou,人往高处走,1954
yu zhou feng,宇宙锋,1954
shi yu zhuo,拾玉镯,1954
xiao bai tu,小白兔,1954
yi jian ti an,一件提案,1954
ji mao xin,鸡毛信,1954
zhan duan mo zhua,斩断魔爪,1954
san nian,三年,1954
wei da de qi dian,伟大的起点,1954
du jiang zhen cha ji,渡江侦察记,1954
huai shang ren jia,淮上人家,1954
shan jian ling xiang ma bang lai,山间铃响马帮来,1954
yi chang feng bo,一场风波,1954
bu neng zou nei tiao lu,不能走那条路,1954
fu nv dai biao,妇女代表,1954
liang shan bo yu zhu ying tai,梁山伯与祝英台,1954
shuang tui mo,双推磨,1954
lan qiao hui,蓝桥会,1954
gai jiao tian de wu tai yi shu,盖叫天的舞台艺术,1954
chuan ju ji jin,川剧集锦,1954
zu guo de hua duo,祖国的花朵,1955
meng he de li ming,猛河的黎明,1955
xia tian de gu shi,夏天的故事,1955
shen mi de lv ban,神秘的旅伴,1955
ping yuan you ji dui,平原游击队,1955
luo xiao lin de jue xin,罗小林的决心,1955
dong cun rui,董存瑞,1955
nu hai qing qi,怒海轻骑,1955
qin xiang lian,秦香莲,1955
da jin zhi,打金枝,1955
mei lan fang de wu tai yi shu （shang ji ）,梅兰芳的舞台艺术（上集）,1955
ha sen yu jia mi la,哈森与加米拉,1955
tian luo di wang,天罗地网,1955
shui xiang de chun tian,水乡的春天,1955
qing chun de yuan di,青春的园地,1955
hu shang de dou zheng,湖上的斗争,1955
min jiang jie zi hong,闽江桔子红,1955
nan dao feng yun,南岛风云,1955
song jing shi,宋景诗,1955
shang jin shan,上金山,1955
guang chang za ji biao yan,广场杂技表演,1955
lian yin,炼印,1955
tian xian pei,天仙配,1955
jiao yin,脚印,1955
huang he da he chang,黄河大合唱,1955
hu xue zhui zong,虎穴追踪,1956
pu bu mie de huo yan,扑不灭的火焰,1956
xin ju zhang dao lai zhi qian,新局长到来之前,1956
ma lan hua kai,马兰花开,1956
ge ge he mei mei,哥哥和妹妹,1956
ma,马,1956
guan bu zhu,关不住,1956
ma ma yao wo chu jia,妈妈要我出嫁,1956
pi bao,皮包,1956
bu ju xiao jie de ren,不拘小节的人,1956
ru ci duo qing,如此多情,1956
guo qing shi dian zhong,国庆十点钟,1956
shang gan ling,上甘岭,1956
liu qiao er,刘巧儿,1956
hua mu lan,花木兰,1956
mei lan fang de wu tai yi shu （xia ji ）,梅兰芳的舞台艺术（下集）,1956
luo shen,洛神,1956
huang shan lei,荒山泪,1956
zhu fu,祝福,1956
wei le he ping,为了和平,1956
chun tian lai le,春天来了,1956
qiu weng yu xian ji,秋翁遇仙记,1956
xiao bai qi de feng bo,小白旗的风波,1956
shei shi xiong shou,谁是凶手,1956
mu qin,母亲,1956
luo shui ji,落水记,1956
xiao huo ban,小伙伴,1956
li shi zhen,李时珍,1956
liang ge xiao zu qiu dui,两个小足球队,1956
tie dao you ji dui,铁道游击队,1956
jia,家,1956
sha mo li de zhan dou,沙漠里的战斗,1956
sou shu yuan,搜书院,1956
shi wu guan,十五贯,1956
song shi jie,宋士杰,1956
an tang xiang hui,庵堂相会,1956
zhou xin fang de yi shu sheng huo,周信芳的艺术生活,1956
an tang ren mu,庵堂认母,1956
ge ma,葛麻,1956
chong po li ming qian de hei an,冲破黎明前的黑暗,1956
zhei jue bu shi xiao shi qing,这决不是小事情,1956
you yuan jing meng,游园惊梦,1956
huang hua ling,黄花岭,1956
bao feng yu zhong de xiong ying,暴风雨中的雄鹰,1957
ji jing de shan lin,寂静的山林,1957
wei wan cheng de xi ju,未完成的喜剧,1957
fu shi,复试,1957
qing chun de jiao bu,青春的脚步,1957
xun ai ji,寻爱记,1957
di xia jian bing,地下尖兵,1957
lu sheng lian ge,芦笙恋歌,1957
bian zhai feng huo,边寨烽火,1957
mu nv jiao shi,母女教师,1957
mu ren zhi zi,牧人之子,1957
li er sao gai jia,李二嫂改嫁,1957
hu die bei,蝴蝶杯,1957
jie nian,借年,1957
qun ying hui,群英会,1957
jie dong feng,借东风,1957
du shi niang,杜十娘,1957
yan dang shan,雁荡山,1957
yang cheng an shao,羊城暗哨,1957
dong xiao heng chui,洞箫横吹,1957
qiu chang feng bo,球场风波,1957
hai hun,海魂,1957
mu tong tou jun,牧童投军,1957
ye lin qu,椰林曲,1957
qing zhang qi shen,情长旗深,1957
nv lan 5hao,女篮5号,1957
wu hai ye hang,雾海夜航,1957
xing fu,幸福,1957
bai yue ji,拜月记,1957
chen san wu niang,陈三五娘,1957
luo han qian,罗汉钱,1957
a fu xun bao ji,阿福寻宝记,1957
feng huang zhi ge,凤凰之歌,1957
hu shi ri ji,护士日记,1957
cheng feng po lang,乘风破浪,1957
bu ye cheng,不夜城,1957
zhan dou li cheng zhang,战斗里成长,1957
shui,水,1957
liu bao de gu shi,柳堡的故事,1957
wu geng han,五更寒,1957
ji zhan qian ye,激战前夜,1957
chuan shan ju long,穿山巨龙,1957
da mu jiang,大木匠,1957
hua hao yue yuan,花好月圆,1958
min bing de er zi,民兵的儿子,1958
hong hai zi,红孩子,1958
shui ku shang de ge sheng,水库上的歌声,1958
dang de nv er,党的女儿,1958
xu qiu ying an jian,徐秋影案件,1958
xuan ya,悬崖,1958
gu cha zhong sheng,古刹钟声,1958
ta ai shang le gu xiang,她爱上了故乡,1958
gong di qing nian,工地青年,1958
nv she zhang,女社长,1958
li ming de he bian,黎明的河边,1958
dong feng,东风,1958
xin lian xin,心连心,1958
huan nan zhi jiao,患难之交,1958
san nian zao zhi dao,三年早知道,1958
bing jian qian jin,并肩前进,1958
bai shou qi jia,白手起家,1958
hua zhong ren,画中人,1958
lie bing deng zhi gao,列兵邓志高,1958
xin de yi ke,新的一课,1958
fu wu yuan,服务员,1958
shuai qi piao piao,帅旗飘飘,1958
chun shui zhang liu,春水长流,1958
shang ba de gu shi,伤疤的故事,1958
kuai ma jia bian,快马加鞭,1958
hong ling jin de gu shi,红领巾的故事,1958
tian xia wu nan shi,天下无难事,1958
chun lei,春雷,1958
bao shan zhi ge,宝山之歌,1958
huo yan ju,火焰驹,1958
feng zheng,风筝,1958
shang hai gu niang,上海姑娘,1958
sheng huo de lang hua,生活的浪花,1958
tan qin ji,探亲记,1958
shi san ling shui ku chang xiang qu,十三陵水库畅想曲,1958
shan li de ren,山里的人,1958
yi tian yi ye,一天一夜,1958
liu hu xin song,柳湖新颂,1958
ping fan de shi ye,平凡的事业,1958
ye zou luo tuo ling,夜走骆驼岭,1958
hong se de zhong zi,红色的种子,1958
shen shan li de ju hua,深山里的菊花,1958
xiao kang ren jia,小康人家,1958
zhan dou de shan cun,战斗的山村,1958
cui gu zhong sheng,翠谷钟声,1958
cong ming de ren,聪明的人,1958
shei shi bei pao qi de ren,谁是被抛弃的人,1958
di san ci shi yan,第三次试验,1958
gang ren tie ma,钢人铁马,1958
ju lang,巨浪,1958
you chuan huo yan,油船火焰,1958
dian xing bao gao,典型报告,1958
chang qing shu,常青树,1958
wang jiang heng,望江亨,1958
xia xiang yu gan jiao,下乡与赶脚,1958
lan lan he dong dong,兰兰和冬冬,1958
san mao xue sheng yi,三毛学生意,1958
tie chuang lie huo,铁窗烈火,1958
da yue jin zhong de xiao zhu ren,大跃进中的小主人,1958
qian fang lai xin,前方来信,1958
bu gu niao you jiao le,布谷鸟又叫了,1958
qian nv nao hai,千女闹海,1958
da feng lang li de xiao gu shi,大风浪里的小故事,1958
huang bao mei,黄宝妹,1958
20tian ge ge ming,20天革个命,1958
ying xiong gan pai ke,英雄赶派克,1958
zhong yao de yi ke,重要的一课,1958
liang ge ying ye yuan,两个营业员,1958
gang hua bian di kai,钢花遍地开,1958
ni zhui wo gan,你追我赶,1958
hai shang hong qi,海上红旗,1958
xin an jiang shang,新安江上,1958
zhen zhu ji,珍珠记,1958
liu jie mei,刘介梅,1958
lin chong,林冲,1958
liang ge xun luo bing,两个巡逻兵,1958
miao jia er nv,苗家儿女,1958
wu ming ying xiong,无名英雄,1958
lu ban de chuan shuo,鲁班的传说,1958
san ba he bian,三八河边,1958
ai chang ru jia,爱厂如家,1958
di yi lie kuai che,第一列快车,1958
xiao fang zhi ge,消防之歌,1958
wo long hu,卧龙湖,1958
tie shu hua kai,铁树花开,1958
gang cheng hu jiang,钢城虎将,1958
re lang ben teng,热浪奔腾,1958
mu gui ying gua shuai,穆桂英挂帅,1958
qing tan,情探,1958
san ge zhan you,三个战友,1958
hei shan zu ji zhan,黑山阻击战,1958
zhang kong bi yi,长空比翼,1958
hong xia,红霞,1958
ying xiong hu dan,英雄虎胆,1958
du jiang tan xian,渡江探险,1958
yi ri qian li,一日千里,1958
yong bu xiao shi de dian bo,永不消逝的电波,1958
po chu mi xin,破除迷信,1958
fan lao hai tong,返老还童,1958
jin ling chuan,金铃传,1958
hai kuo tian kong,海阔天空,1958
lang ya shan wu zhuang shi,狼牙山五壮士,1958
xian wei shu ji,县委书记,1958
yang guan da dao,阳关大道,1958
jie ban ren,接班人,1958
chuan chang zhui zong,船厂追踪,1959
gang zhu fei che,钢珠飞车,1959
kang zhuang da dao,康庄大道,1959
wo men cun li de nian qing ren （shang ji ）,我们村里的年轻人（上集）,1959
xi cheng de gu shi,锡城的故事,1959
xiao zhu yan kai,笑逐颜开,1959
shi hang,试航,1959
bing shang jie mei,冰上姐妹,1959
jie qin pei,借亲配,1959
wu duo jin hua,五朵金花,1959
feng cong dong fang lai,风从东方来,1959
cao yuan chen qu,草原晨曲,1959
huang he fei du,黄河飞渡,1959
chao xia,朝霞,1959
yun wu shan zhong,云雾山中,1959
qing yun qu,青云曲,1959
san kan hu die meng,三勘蝴蝶梦,1959
hai shang shen ying,海上神鹰,1959
dou e yuan,窦娥冤,1959
jin yu ji,金玉姬,1959
huan le ren jian,换了人间,1959
zhan huo zhong de qing chun,战火中的青春,1959
liu shui huan ge,流水欢歌,1959
qian shao,前哨,1959
chen san liang,陈三两,1959
shuai jing jia,摔镜架,1959
lin jia pu zi,林家铺子,1959
wu ming dao,无名岛,1959
kuang deng,矿灯,1959
fei yue tian xian,飞越天险,1959
feng bao,风暴,1959
qing chun zhi ge,青春之歌,1959
huan tian xi di,欢天喜地,1959
shui shang chun qiu,水上春秋,1959
liang shi,粮食,1959
bai feng chao yang,百凤朝阳,1959
san ge mu qin,三个母亲,1959
lv zhou kai ge,绿洲凯歌,1959
hao hai zi,好孩子,1959
nie er,聂耳,1959
huang pu jiang de gu shi,黄浦江的故事,1959
jin tian wo xiu xi,今天我休息,1959
wan zi gan hong zong shi chun,万紫干红总是春,1959
xiang hai yang,向海洋,1959
qiao lao ye shang jiao,乔老爷上轿,1959
lin ze xu,林则徐,1959
lao bing xin chuan,老兵新传,1959
nv fu ma,女驸马,1959
bai sui gua shuai,百岁挂帅,1959
sheng si pai,生死牌,1959
gang tie shi jia,钢铁世家,1959
chun man ren jian,春满人间,1959
sha mo zhui fei ji,沙漠追匪记,1959
di xia shao xian dui,地下少先队,1959
xiang piao wan li,香飘万里,1959
di xia hang xian,地下航线,1959
chun feng yang liu,春风杨柳,1959
bao lian deng,宝莲灯,1959
zhui yu,追鱼,1959
xing xing zhi huo,星星之火,1959
jie ri ge wu,节日歌舞,1959
bu lao song,不老松,1959
an hui xi qu ji jin,安徽戏曲集锦,1959
hui min zhi dui,回民支队,1959
jiang shan duo jiao,江山多娇,1959
hai ying,海鹰,1959
wan shui qian shan,万水千山,1959
lie huo zhen jin,烈火真金,1959
wu duo hong yun,五朵红云,1959
ying xiong dao,英雄岛,1959
chi feng hao,赤峰号,1959
you yi,友谊,1959
zhan shang hai,战上海,1959
mu gui ying gua shuai,穆桂英挂帅,1959
yu dao zhi zi,渔岛之子,1959
xue hai yin shan,雪海银山,1959
tian shan ge sheng,天山歌声,1959
xian hua duo duo kai,鲜花朵朵开,1959
ren xiao zhi da,人小志大,1959
gan xiang gan zuo de ren,敢想敢做的人,1959
er du mei,二度梅,1959
hai hun ji,还魂记,1960
hong yan,鸿雁,1960
tai yang gang gang chu shan,太阳刚刚出山,1960
tuan yuan zhi hou,团圆之后,1960
kun lun tie qi,昆仑铁骑,1960
zai sheng ji,再生记,1960
tie dao wei shi,铁道卫士,1960
feng huo lie che,烽火列车,1960
shen yang shou,神秧手,1960
shi ji lang,十级浪,1960
pan yang song,潘杨讼,1960
liu san jie,刘三姐,1960
qiang di song,羌笛颂,1960
dong feng di yi zhi,东风第一枝,1960
kong yin he,空印盒,1960
wo men shi yi dai ren,我们是一代人,1960
you yuan jing meng,游园惊梦,1960
wei le liu shi yi ge jie ji xiong di,为了六十一个阶级兄弟,1960
yang men nv jiang,杨门女将,1960
wu cai lu,五彩路,1960
yi ge ming de ming yi,以革命的名义,1960
hong hua bian di kai,红花遍地开,1960
chun nuan hua kai,春暖花开,1960
geng yun bo yu,耕云播雨,1960
hong qi pu,红旗谱,1960
ge ming jia ting,革命家庭,1960
liu shi nian dai di yi chun,六十年代第一春,1960
chuang guan,闯关,1960
ji liu,激流,1960
mian dian wen hua dai biao tuan fang hua yan chu,缅甸文化代表团访华演出,1960
mo ya dai,摩雅傣,1960
ma lan hua,马兰花,1960
guan han qing,关汉卿,1960
qin niang mei,秦娘美,1960
nv shen,女审,1960
ta men de xin yuan,她们的心愿,1960
feng liu ren wu shu jin chao,风流人物数今朝,1960
xiang yang hua kai,向阳花开,1960
dou shi ting,斗诗亭,1960
sun wu kong san da bai gu jing,孙悟空三打白骨精,1960
hong ying zhan chi,红鹰展翅,1960
shi er ci lie che,十二次列车,1960
san ba xian shang,三八线上,1960
ke shan hong ri,柯山红日,1960
lin hai xue yuan,林海雪原,1960
hong ying,红鹰,1960
meng long sha,勐垅沙,1960
qi xi,奇袭,1960
ying xiong shi pian,英雄诗篇,1960
xin dui yuan,新队员,1960
hui yan dan xin,慧眼丹心,1960
bi kong yin hua,碧空银花,1960
yong heng de you yi,永恒的友谊,1960
kang han qu,抗旱曲,1960
cao yuan feng bao,草原风暴,1960
san di xue,三滴血,1960
yi wen qian,一文钱,1960
jia ling jiang bian,嘉陵江边,1960
liang dai ren,两代人,1960
qin ren,亲人,1960
ge ming feng bao zhan sheng long juan feng,革命风暴战胜龙卷风,1960
fu zi liang,父子俩,1960
ta men zai zhan dou,他们在战斗,1960
bei lei chu kai,蓓蕾初开,1960
ma xi tuan de xin jie mu,马戏团的新节目,1961
wan mu chun,万木春,1961
jian shui dong liu,涧水东流,1961
dong mei,冬梅,1961
shu jia de li wu,暑假的礼物,1961
hong hu chi wei dui,洪湖赤卫队,1961
bao feng zhou yu,暴风骤雨,1961
chun lei,春雷,1961
bei da huang ren,北大荒人,1961
51hao bing zhan,51号兵站,1961
ku mu feng chun,枯木逢春,1961
man luo hua,蔓萝花,1961
chun cui tao li,春催桃李,1961
hong se niang zi jun,红色娘子军,1961
ying xiong xiao ba lu,英雄小八路,1961
xiao dao hui,小刀会,1961
tu po wu jiang,突破乌江,1961
bi kong xiong shi,碧空雄师,1961
hong shan hu,红珊瑚,1961
li jing ji,荔镜记,1961
ba shan hong lang,巴山红浪,1961
yan an you ji dui,延安游击队,1961
da ji he ta de fu qin,达吉和她的父亲,1961
yuan fang xing huo,远方星火,1961
feng xue da bie shan,风雪大别山,1961
kou zhun bei xue,寇准背靴,1961
qi tian qi ye,七天七夜,1962
san guan pai yan,三关排宴,1962
liu yi chuan shu,柳毅传书,1962
jia wu feng yun,甲午风云,1962
lu huo zheng hong,炉火正红,1962
hua er duo duo,花儿朵朵,1962
kun lun shan shang yi ke cao,昆仑山上一棵草,1962
yang nai wu yu xiao bai cai,杨乃武与小白菜,1962
ye zhu lin,野猪林,1962
ting zhan yi hou,停战以后,1962
a na er han,阿娜尔罕,1962
jin shang tian hua,锦上添花,1962
sun an dong ben,孙安动本,1962
li shuang shuang,李双双,1962
hong lou meng,红楼梦,1962
bi yu zan,碧玉簪,1962
mo shu shi de qi yu,魔术师的奇遇,1962
nv li fa shi,女理发师,1962
liao yuan,燎原,1962
da li 、xiao li he lao li,大李、小李和老李,1962
dong jin xu qu,东进序曲,1962
ge liang hao,哥俩好,1962
huai shu zhuang,槐树庄,1962
di lei zhan,地雷战,1962
e er duo si feng bao,鄂尔多斯风暴,1962
bi hai dan xin,碧海丹心,1962
ying xiong tan ke shou,英雄坦克手,1962
han jiang hua si jin,韩江花似锦,1962
nan hai chao （shang ji ）,南海潮（上集）,1962
qi wang qiu jiang,齐王求将,1962
hong ye ti shi,红叶题诗,1962
sheng ming de huo hua,生命的火花,1962
shang xiao yun wu tai yi shu,尚小云舞台艺术,1962
qiao tai shou luan dian yuan yang pu,乔太守乱点鸳鸯谱,1962
bing shan shang de lai ke,冰山上的来客,1963
hua wei mei,花为媒,1963
zi you hou lai ren,自有后来人,1963
chao yang gou,朝阳沟,1963
wo men cun li de nian qing ren （xu ji ),我们村里的年轻人（续集),1963
man yi bu man yi,满意不满意,1963
liang jia ren,两家人,1963
qiang tou ma shang,墙头马上,1963
bing xue jin da lai,冰雪金达莱,1963
fen shui zhang liu,汾水长流,1963
hong he ji lang,红河激浪,1963
zao chun er yue,早春二月,1963
xiao bing zhang ga,小兵张嘎,1963
chun yan zhan chi,春燕展翅,1963
mu gui ying da zhan hong zhou,穆桂英大战洪州,1963
xiong mei tan bao,兄妹探宝,1963
fei dao hua,飞刀华,1963
you san jie,尤三姐,1963
ru ci die niang,如此爹娘,1963
bei guo jiang nan,北国江南,1963
shui shou zhang de gu shi,水手长的故事,1963
niu lang zhi nv,牛郎织女,1963
hong ri,红日,1963
jin sha jiang pan,金沙江畔,1963
bao hu lu de mi mi,宝葫芦的秘密,1963
can hua gu niang,蚕花姑娘,1963
wu song,武松,1963
shuang zhu feng,双珠凤,1963
huai yin ji,槐荫记,1963
qiu mi,球迷,1963
ye huo chun feng dou gu cheng,野火春风斗古城,1963
nong nu,农奴,1963
nu chao,怒潮,1963
zhua zhuang ding,抓壮丁,1963
ge ming li shi ge qu biao yan chang,革命历史歌曲表演唱,1963
duo yin,夺印,1963
gen zong zhui ji,跟踪追击,1963
qi shi er jia fang ke,七十二家房客,1963
mao zi pei chuang gong,毛子佩闯宫,1963
tao hua shan,桃花扇,1963
zha mei an,铡美案,1964
du li da dui,独立大队,1964
bing lin cheng xia,兵临城下,1964
ying xiong er nv,英雄儿女,1964
hong guan jia,红管家,1964
hao xi fu,好媳妇,1964
nan hai de zao chen,南海的早晨,1964
nv tiao shui dui yuan,女跳水队员,1964
cai die fen fei,彩蝶纷飞,1964
xiao ling dang,小铃铛,1964
qing nian lu ban,青年鲁班,1964
xiao er hei jie hun,小二黑结婚,1964
qian wan bu yao wang ji,千万不要忘记,1964
cao yuan xiong ying,草原雄鹰,1964
jian gan he bian,箭杆河边,1964
qing shan lian,青山恋,1964
a shi ma,阿诗玛,1964
feng shou zhi hou,丰收之后,1964
li shan zi,李善子,1964
bai qiu en da fu,白求恩大夫,1964
jia ting wen ti,家庭问题,1964
ni hong deng xia de shao bing,霓虹灯下的哨兵,1964
xue bei,血碑,1964
an bian ji lang,岸边激浪,1964
dai bing de ren,带兵的人,1964
lei feng,雷锋,1964
fen shui ling,分水岭,1964
xu ri dong sheng,旭日东升,1964
dong feng wan li,东风万里,1964
ni feng qian li,逆风千里,1964
liu ming zhu,刘明珠,1964
tian shan de hong hua,天山的红花,1964
shan cun hui ji,山村会计,1965
san jin shan cheng,三进山城,1965
jing po gu niang,景颇姑娘,1965
“te kuai ”lie che,“特快”列车,1965
qing song ling,青松岭,1965
lu kao,路考,1965
chuan qiang ji,传枪记,1965
bai shan xin ge,白山新歌,1965
yi ke hong xin,一颗红心,1965
jin yao chi,金钥匙,1965
duo duo hong hua xiang tai yang,朵朵红花向太阳,1965
jie zhen guo,节振国,1965
lie huo zhong yong sheng,烈火中永生,1965
mei dian xin gong ren,煤店新工人,1965
shan cun jie mei,山村姐妹,1965
hong se bei lou,红色背篓,1965
long ma jing shen,龙马精神,1965
hua bei qu ye yu hua ju wu tai yi shu pian （shang ji ）,华北区业余话剧舞台艺术片（上集）,1965
hua bei qu ye yu hua ju wu tai yi shu pian （xia ji ）,华北区业余话剧舞台艺术片（下集）,1965
mai niu 、ba gua yuan,买牛、扒瓜园,1965
san duo xiao hong hua,三朵小红花,1965
lang tao gun gun,浪涛滚滚,1965
xiao zu qiu dui,小足球队,1965
huang sha lv lang,黄沙绿浪,1965
hong hua qu,红花曲,1965
nong jia bao 、liang long di,农家宝、两垅地,1965
zhei shi wo ying gai zuo de,这是我应该做的,1965
gu sao lian wu,姑嫂练武,1965
nian qing de yi dai,年青的一代,1965
ju tai,柜台,1965
wu tai jie mei,舞台姐妹,1965
xi qu ji jin,戏曲集锦,1965
shang hai zhi chun,上海之春,1965
wo men ai nong cun,我们爱农村,1965
fu jian gong yi xin hua,福建工艺新花,1965
shang hai shi shao nian er tong ge ming ge wu xuan ji,上海市少年儿童革命歌舞选辑,1965
da ji qin lve zhe,打击侵略者,1965
ku cai hua,苦菜花,1965
mi mi tu zhi,秘密图纸,1965
di dao zhan,地道战,1965
sheng li zai wang,胜利在望,1965
ye lin nu huo,椰林怒火,1965
jun ken zhan ge,军垦战歌,1965
dong fang hong,东方红,1965
shuang jiao zi,双教子,1965
shan cun xin qu,山村新曲,1965
da tong luo 、bu guo,打铜锣、补锅,1965
hong mei ling,红梅岭,1965
ren huan ma jiao,人欢马叫,1965
jun ge liao liang,军歌嘹亮,1965
ha er bin zhi xia,哈尔滨之夏,1966
yan hong ling xia,雁鸿岭下,1966
hong se you lu,红色邮路,1966
nv fei xing yuan,女飞行员,1966
hong shi zhong sheng,红石钟声,1966
ta men zai cheng zhang,他们在成长,1966
shang hai gong yi mei shu,上海工艺美术,1966
yi bai ge fang xin,一百个放心,1966
qing chun hong si huo,青春红似火,1966
you xiang,游乡,1966
jie niu,借牛,1966
song liang,送粮,1966
da lang tao sha,大浪淘沙,1966
yi dai mai zhong,一袋麦种,1966
lao bao guan 、xin xi fu lai le,老保管、新媳妇来了,1966
yi chuan xiang lian,一串项链,1966