Romanized,Title,Year,Translated,Production,Colour,Special Aspects,Director,Scriptwriter,Actors/Actresses,Other Staff,Plot
yin hai huan meng,银海幻梦,1949,A Dream in the World of Cinema,中央电影摄影场一厂,B&W,Added on 26/Apr/2023,唐煌,,岳路 / 秦文 / 朱月影 / 罗丹 / 孙侠 / 徐缓 / 李丹凝 / 应国珍 / 杨雪如 / 李静康 / 高秋 / 沈继禹 / 苏鸿 / 钱能 / 陈濠 / 叶小铿 / 邵华,江上鸥 (执行导演) / 李憾山 (剧本整理) / 罗学濂 (监制) / 裘逸苇 (制片) / 徐昂千 (制片),大年除夕，胡老太爷一家老小十余人聚到了一起。大家都爱好看电影，三小姐提议每人讲述一部自己最喜欢的影片，众人一致赞同，讲至深夜方各自就寝。二小姐梦到了《粉墨筝琶》里的童芷苓对魏鹤龄唱小调的一段，不由微笑，却被丈夫疑为有了外遇。三小姐梦到张伐在《悬崖勒马》中枪杀了白光，心痛不已。四少爷接到电话让全家去拍《寻梦记》，醒来才知仍为一梦……楼下厅中，一家中又聚到了一起，纷纷感叹人生如梦，凡事不必太过认真。
ying cheng qi tan,影城奇谭,1949,Mystery in a Film Studio,Guotai Film Company,B&W,Added on 26/Apr/2023,,,童芷苓 / 欧阳莎菲,柳中浩 (监制) / 周伯勋 (制片主任),以“国泰”成立以来出品的每部影片的主要镜头剪辑而成。影迷俱乐部举行盛大的化装舞会，大家各展所长，化装成自己所崇拜的中外电影明星。突然，楼上传来令人毛骨悚然的尖叫，舞场秩序大乱。一名女演员中弹倒在地上，一个身形庞大的黑影从走廊一头掠过，又迅速下楼，进入大门外的汽车后扬长而去。为查明真相，几名影迷紧随而去。汽车在一家电影公司门前停下，黑影大摇大摆进了大门。影迷们也想办法混了进去，并闯进了摄影棚。他们终于找到了大黑影，却原来是一架罩着黑布的摄影机。
zai sheng nian hua,再生年华,1949,His Years of Being Reborn,华侨影业公司 (Hong Kong),B&W,Added on 26/Apr/2023,唐绍华,陶熊,项堃 / 李季 / 阮斐 / 严斐 / 叶小铿 / 于复瑛 / 严俊 / 胡小菡 / 白郎 / 江山 / 苏鸿 / 朱月影 / 梁明 / 董霖 / 陈娟娟 / 朱红 / 苏曼意 / 田太宣 / 冯继雄 / 何剑飞,杜振昆 (洗印) / 叶苗 (布景) / 徐平 (剧务) / 高运昌 (灯光) / 吴江海 (录音) / 李农 (场记) / 许荷香 (剪辑) / 许明 (剪辑) / 李生伟 (摄影) / 黄贻钧 (作曲) / 陆洪恩 (音乐) / 沈西琳 (制片) / 项堃 (制片) / 李君侠 (监制),邬万里是一家公司的职员。他的妻子吴惠娟非常贤惠，夫妻俩结婚12年有一子一女，生活还算幸福。因为万里贫穷，常常受到岳母的嘲讽，万里便帮助别人销售私货，由于警察来抓，他立即逃走。在外面呆了许多年，家人都以为他已经死了。惠娟在其母的逼迫下，带着儿女嫁给了富豪朱润干。有一天，万里在报纸上看到女儿即将举办音乐会的消息，立刻赶回家乡，万里在音乐会上见到了妻子和女儿，也知道儿子已在其继父的影响下堕落成了不良青年。为了不影响女儿的生活，万里忍着悲痛继续过着流离颠沛的生活。
chou shen si hai,仇深似海,1950,The Deepest Hatred,Guotai Film Company,B&W,Added on 26/Apr/2023,徐苏灵,吴铁翼,周曼华 / 高占非 / 沈扬 / 周起 / 高笑鸥 / 白荷 / 陶由 / 苏曼意,,殷福堂是江南小镇南河泾的恶霸地主，为给灵通寺的菩萨开光向乡民强派壮丁。青年张全根被抽中，在未婚妻阿双之父陈老爹的指点下，全根去苏北投奔打游击的同乡阿康。得知全根逃跑，殷福堂强行将阿双之兄阿本拉去顶替，从此音信全无。狗腿子侯三对阿双图谋不轨未遂，借征粮之事对陈家百般刁难。淮海战役打响，殷福堂自知气数将尽，竟欲将陈老爹活埋。危急之时全根带着游击队赶到，解放了南河泾，救出了陈老爹，殷福堂亦被活捉。
he ping ge,和平鸽,1951,Peace Dove,Da Guangming Film Company,B&W,Added on 26/Apr/2023,陶金,刘任涛,顾而已 / 张立德 / 郑敏 / 陶金 / 周璇 / 顾也鲁 / 高占非 / 张琬 / 王凯 / 戴衍万 / 白荻 / 白兰 / 陈家青 / 王海兰 / 钱玲 / 周静 / 陈小英 / 薛咏 / 徐薇 / 何小玲 / 康瑛 / 田音 / 李凯 /李行 / 陈雷 / 金奇 / 林默予 / 苏曼意 / 贺宾 / 张涵 / 张铮 / 陈风 / 晨波 / 王桂林 / 华华 / 于复美,丁里 (副导演) / 陈震祥 (摄影) / 贡明熙 (摄影助理) / 徐存和 (照明) / 邵子和 (录音) / 任心良 (录音) / 杭子玉 (洗印) / 严兆德 (洗印) / 张立群 (剪辑) / 沈维善 (布景) / 林福增 (美术) / 时金彪 (剧务) / 韩杰纵 (剧务) / 奚良 (道具) / 陈凤 (服装) / 王凯 (化妆) / 李露清 (场务) / 陈阐蝉 (场记),上海解放后，市人民医院全体员工在工会主席、外科齐主任的带领下积极响应市总工会提出的“红五月生产竞赛活动”。钢铁厂工人王祥义因工骨折，主治医生赵大夫未加仔细诊治便草率地做了手术，王祥义离院后再度骨折。齐主任检讨自己领导失当，让赵大夫女友、外科护士蔡愉英亲自接王祥义回医院重做手术。美国侵入朝鲜半岛，齐大夫、蔡愉英等积极报名参加志愿赴朝医疗队，受齐太太刚从美国归来的弟弟的影响，赵大夫等亦纷纷报名赴朝...
san dui fu qi,三对夫妻,1950,Three Couples,Wenhua Film Company,B&W,Added on 26/Apr/2023,胡心灵,胡心灵,龚秋霞 / 吴茵 / 闵翠英 / 罗军 / 李君磐 / 红叶 / 姚萍 / 顾文宗 / 胡蓉蓉 / 赵突山,张丙生 (制片),江南干旱，百姓穷苦，小学校长金达人不得不关闭经营多年的学校，带着妻儿到上海寻找出路。一家人来到身为投机商的大哥金梦如家探望母亲，却看到金梦如正为亡父做九十诞辰阴寿，宾客如云。达人触景伤情，与金梦如话不投机，不欢而散。经朋友介绍，达人在报社找了份工作。金梦如非法屯米的勾当暴露，受到舆论广泛抨击。金梦如找达人帮忙，欲以金钱平息舆论，达人断然拒绝。金梦如怀恨在心，设计将达人陷害入狱……
xiang si shu,相思树,1951,The Tree of Love,Wenhua Film Company,B&W,Added on 26/Apr/2023,韩义 / 黄绍芬,钟泯 / 邵慕水,陈金莲 / 冯笑侬 / 王忠蝉 / 裘幼凤 / 任梅仙 / 筱风娟 / 沈小梅 / 金小芳 / 刘宝华 / 冯文锦 / 胡美云 / 徐小红 / 王琼仙 / 朱明明 / 袁如芬 / 张茵 / 筱水招 / 魏凤娟 / 王艳霞 / 袁雪芬 / 金艳芳 / 程奉先 / 沈月芳 / 胡少鹏 / 高剑琳 / 丁兆丰 / 李月芬 / 苏胜奎 / 金琳,许琦 (摄影) / 徐志良 (摄影) / 张锡龄 (摄影助理) / 谈鹤鸣 (录音指导) / 朱薇江 (录音) / 吴报章 (录音) / 毛根 (录音助理) / 沈孝祥 (录音助理) / 王月白 (布景) / 刘松年 (美术) / 牛汉城 (美术) / 马玮 (洗印) / 何超 (洗印) / 张玉 (洗印) / 吴报章 (剪辑) / 徐进 (剧务) / 曹韦 (剧务) / 马斐 (剧务) / 王洁 (场记) / 倪亦非 (化妆) / 张伟秋 (道具) /  马鸿祥 (服装) / 雪声剧团 (音乐) / 刘如曾 (指挥),宋国人韩凭，离别新娘贞夫上京求官，6年不归，贞夫绣鱼书，托人捎给韩凭，韩见鱼书相思入梦。上朝钟响，韩怀鱼书匆匆进宫，不慎鱼书落地，为好色无道的宋王所见，诬为奸细打入土牢。宋王将贞夫接来宫中，见她貌美，封为新娘娘，贞夫不从，宋王让贞夫与韩凭在清凌台相见，又毁韩容，贞夫借弓箭射血书于台下，韩接读血书后触箭自杀，贞夫亦跳台自尽，临死前求与夫合葬一处。宋王大怒，命分葬两处，遥遥相对，日后两坟前各长一树，渐成合抱。宋王命砍树，树倒，飞出一对鸳鸯，宋王发箭射下一片羽毛，取之观赏，毛忽生火，烧死宋王。不久两树重长，后人谓之相思树。 
yuan yang jian,鸳鸯剑,1951,Yuenyeung Sword,Guotai Film Company,B&W,Added on 26/Apr/2023,徐苏灵,林朴晔 / 卢敏,金川 / 王熙春 / 周起 / 马骥 / 顾德刚 / 李虹 / 李保罗 / 徐曼 / 康泰 / 沈亚伦 / 关宏达 / 冯奇 / 陶由 / 杨芳菁 / 许垦 / 冯继雄 / 王钩,,南宋时期，宋将焦光瓒率部投降金军，宋人引以为耻，贬去其部属之籍，将他们集中于绍兴一带，统称“堕民”，不得与一般平民通婚，更不得应试科举。转眼已是明朝末年，“堕民”裘江海与汪志豪情同手足，但志趣不同。江海为改变命运前去投奔闯王李自成，志豪则一意考取功名，并改名李志建投于学宿黄仲渊门下。富绅秦勉甫之女蕙兰与志建喜强连理，志建将家传的鸳鸯剑相赠。后志建考得了功名，真相却不幸暴露。秦勉甫欲行严办，蕙兰决意与志建生死相随。