Romanized,Title,Year,Translated,Production,Colour,Special Aspects,Director,Scriptwriter,Actors/Actresses,Other Staff,Plot
shen tao da,审陶大,1959,Trailing Tao Da,Haiyan Film Studio & Wuhan Film Studio,B&W,Added on 25/Apr/2023; Hanchu Opera; Adapted from opera 《白罗衫》,李紫贵,,李春林 / 李四立,胡和道 (摄影),水匪陶大杀死徐继祖的父亲，收留除母遗落的徐继祖为儿子。18年后，徐继祖升任巡按，查知养父陶大其实是杀父仇人。经过连夜审问，将他判刑。
bao zhong qu bao,宝中取宝,1958,Seeking Treasures in a Treasure,Changchun Film Studio,B&W,Added on 25/Apr/2023,刘国权,集体创作,白英宽 / 周文斌 / 黄世光 / 王景芳 / 崔隐 / 王金荣 / 江长华,王岚 (副导演) / 丹森尼玛 (副摄影) / 杨业 (副摄影) / 纪自强 (美术) / 李振铎 (录音) / 潘英 (剧务主任) / 陈奇芬 (作曲) / 长影乐团 (演奏) / 尹升山 (指挥),在大跃进的年代里，工人技术员老贺为了研究提炼稀有金属锗的工艺，废寝忘食地刻苦读书，努力钻研，以自己的实际行动批判了迷信书本和苏联专家的主任工程师。由于试验出了事故，老贺受到了领导的批评，他虚心接受了批评。在党委的支持下，他与同志们组成了研究小组，群策群力攻难关。工人杜师傅在试验中受伤。老贺又改用新的方法试验，终于成功地提炼出了锗。
duo deng,躲灯,1959,Away from Lanterns,Haiyan Film Studio,B&W,Added on 25/Apr/2023,夏天,夏天,胡小菡 / 康泰 / 蒋锐 / 廖瑞群,陆仲伯 (录音) / 邱以仁 (摄影) / 蒋浩生 (制片) / 张庚新 (作词) / 申云 (演唱),风俗上说新媳妇不能在婆家过灯节，在婆家过灯节就会闹眼睛疼。快到正月十五了，按照家乡的老规矩，女婿刘庆云赶着毛驴，送新媳妇范巧灵回娘家躲灯。公路上到处是在大跃进中参加劳动的人流，刘庆云害臊地把驴赶上了小路。范巧灵发现后，又将牲口拉了回来。一路上，他们发现家乡已经发生了巨大的变化，新修了铁路。路上他们遇到相熟的青年，大伙儿开玩笑说你们是去躲灯吧。刘庆云听到这些话，又羞又气，不禁责备起妻子来，两人因此发生争吵。在小两口就要走进村的时候，两个红领巾在扫盲站文化岗前拦住了他们，范巧灵结结巴巴地讲不出“打破常规过新春”的意思，受到了批评。刘庆云生气地要回家，范巧灵则要他见到丈人丈母后再走。刘庆云见范家大门挂着锁，牵着毛驴转身往回走，范巧灵气得哭了起来。丈人丈母刚好回来，拦住了他们。在老人的帮助教育下，范巧灵认识到了自己的错误，决定给父母拜完年就回去参加大跃进。小两口高高兴兴转回家。
song wen shen,送瘟神,1959,Overcoming Schistosomiasis,Tianma Film Studio,B&W,Added on 25/Apr/2023; Also known as 《在血防战线上》,岑范,汪自强 / 周杰,谢怡冰 / 杨梦昶 / 冯奇 / 凤凰 / 李农 / 蒋天流 / 铁牛 / 张惠钧 / 路珊 / 高笑鸥 / 张鸿鑫,陈传熙 (指挥) / 张林漪 (作曲) / 石凤歧 (摄影) / 张驾珊 (剪辑) / 何瑞基 (美术) / 姜永昌 (化妆) / 汤丽绚 (制片) / 黄东萍 (录音),影片表现了1957年，江西省余江县的血吸虫病防工作者，为群众防治血吸虫病取得成功的事迹。
zhou xin fang de wu tai yi shu,周信芳的舞台艺术,1961,Zhou Xinfang’s Art of Stage Performance,Tianma Film Studio,Colour,Added on 25/Apr/2023; Peking Opera,应云卫 / 杨小仲,,周信芳,张鑫海 (司鼓) / 吴树萌 (剪辑) / 卢俊福 (摄影) / 王月白 (美术) / 龚建清 (录音) / 殷子 (副导演) / 李萍 (化妆) / 丁里 (制片主任) / 张鑫海 (指挥) / 郝德泉 (琴师),本片是周信芳代表作中的两个剧目。《徐策跑城》是民间传说“薛家将”中的一折。 唐代，薛仁贵的后代薛丁山遭到奸臣张泰等人的陷害，被满门抄斩。徐策同情薛家的遭遇，心中十分感慨。在行刑前，徐策用自己的孩子换下薛猛的孩子薛蛟，并将他抚养成人。一日，徐策让薛蛟到韩山下书，约同他的三叔父薛刚和三婶母纪鸾英发兵为薛家报仇。徐策得知薛刚率领人马来到长安时，不顾自己年迈体弱，亲自上城观望，并打开城门欢迎他们。薛家兵欲杀人紫禁城，报仇血恨。徐策考虑到江山社稷的安定，便当面应允为薛刚、薛蛟亲自上殿奏本，请求皇上杀死奸贼张泰，为薛家伸冤，若皇上不准，薛家兵马再杀进城去，讨伐奸贼。于是，薛刚命令兵马后退40里，等候徐策的消息。徐策看到薛家后代威风凛凛，薛家军兵强马壮，感到国家有望，非常高兴，竟顾不得骑马、坐轿，急急忙忙跑进皇宫上朝奏本。 《下书杀惜》:山东郓城县押司宋江，曾经援救劫夺“生辰纲”的晁盖、吴用、刘唐等人。晁盖等人投奔水泊梁山后，为报答宋江救命之恩，便派刘唐带书信一封、黄金百两，前去郓城看望宋押司。一日，宋江遇见刘唐，连忙将他拉到一个僻静的酒楼叙谈。他匆匆收下一锭银子，便将书信与那锭银子急忙放进招文袋里；并催促刘唐带上其余的银子速返梁山。宋江送走刘唐之后，遇到正在寻找他的阎婆。阎婆曾受宋江赠金葬夫之恩，就将女儿阎惜姣许给宋江作外室，住在乌龙院，而阎惜姣却暗中与宋江的学生张文远来往。于是，宋江发誓不再见阎惜姣。阎婆前来找他，宋江迫不得已，只得去了乌龙院。第二天，宋江仓促出门，不慎将招文袋丢在地上。阎惜姣睡醒后，拾起招文袋，发现了宋江与梁山来往的书信。当宋江回来寻找招文袋时，阎惜姣乘机要挟宋江，让他立即写下休书，任凭自己改嫁张文远。宋江为要回梁山书信，只好答应了她的要求。不料，阎惜姣接过书信后，却扬言要在郓城县的大堂上才能交出梁山书信，欲置宋江于死地。宋江被逼无奈，只得将阎惜姣杀死。
ji mao fei shang tian,鸡毛飞上天,1961,When a Feather Flies,Jiangsu Film Studio & Tianma Film Studio,B&W,Added on 25/Apr/2023,傅超武,王风 / 傅超武 / 穆宏 / 李培健,张辉 / 穆宏 / 高笑鸥 / 齐衡 / 范雪朋 / 田野 / 于冲 / 李农 / 杨智 / 赵国祥 / 丁世玉 / 沈玉芳 / 江燕,张锡龄 (摄影) / 贺路 (副导演) / 王风 (副导演) / 何瑞基 (美术) / 周云麟 (录音) / 张林漪  (作曲) / 陶侃 (制片),苏北地区，十荒生产大队由于守着上千亩的盐碱地，年年闹饥荒，年年靠救济。社员们一心希望早日改变大队的落后面貌，但是出身富裕中农的钱信贵在群众中散布，说什么：“要是能拔掉穷根，除非鸡毛飞上天!”正巧，大队党支部书记蔡刚从县里开会回来，听到钱信贵的话，立即给予反驳，“毛主席说，鸡毛就是要飞上天!”蔡刚遵照县委关于穷队要改变落后面貌的精神，积极带领大队骨干研究翻身计划。十荒大队过去由于缺水，一直种旱谷，但产量较低。为增产增收，必须引水开渠，改种水稻。大队长张友望思想保守，担心开渠难度大，万一开不成，今年社员的口粮就要落空。就在社员们引水开渠工作于得热火朝天的时候，工地上遇到僵土。钱信贵为了个人发家致富，一心想着自己的副业。他看到工程遇到困难，趁机暗中散布谣言，使社员们人心惶惶。这时，公社党委王书记来到十荒大队，鼓励大家要树雄心、立大志，克服困难，完成开渠任务。同时，他还提醒蔡刚不要只看到工地上表面的困难，要注意落后分子形成的资本主义自发势力。之后，蔡刚组织生产大队召开辩论大会。辩论会上，社员们对钱信贵的小农意识和走资本主义道路思想进行了揭发和批判，使全体社员都受到了教育，认清了要使十荒大队改变贫穷落后面貌，必须要走社会主义集体化道路。这时。大队长张友望也认识到自己思想保守的错误。十荒大队的领导和群众统一了思想认识，以饱满的热情和干劲，投入了热火朝天劳动中去了。最后，他们克服了种种困难，终于开通了引水渠。这一年，十荒大队夺得水稻大丰收。打谷场上呈现着节日的景象，人群往来如穿梭，劳动声、机器声、歌唱声以及欢笑声汇成了一曲振奋人心的乐章。蔡刚告诉来到打谷场的王书记，今年“除了种子粮、口粮、饲料之外，我们还可以卖余粮了”。王书记对大家说：鸡毛是飞上天了，不过这只是开始……他要社员们抓紧时机，立即进行秋耕。不久，十荒大队经公社批准，改名为“跃进大队”。
long fei feng wu,龙飞凤舞,1959,The Dances of Dragons and Phenix,August First Film Studio,Colour,Added on 25/Apr/2023; Artistic documentary,瞿超,,王静江 / 吴玉琴,吴迪 (摄影) / 麦一 (美术) / 李伟才 (作曲) / 吴汉标 (录音) / 王铁林 (场记) / 高艺学 (舞蹈指导) / 孙正 (指挥) / 何化居 (指挥) / 宏特 (指挥),《龙飞凤舞》是一部舞蹈故事片，它以一对男女青年的爱情故事为主线，串演了在第五届、第六届世界青年与学生和平友谊联欢节上获奖的舞蹈节目：《龙舞》、《孔雀舞》、《织女穿花》、《挤奶．员舞》以及部分广大群众喜闻乐见的民间歌舞：《洛子舞》、《马刀舞》、《踢球舞》、《吉庆有余》等。由于这类的片子收入的舞蹈多为艺术精品，观赏性比较强，而且又有故事情节的贯穿，所以很容易达到雅俗共赏，受到广大观众的欢迎和喜爱，是很有广阔发展前途的舞蹈电视片种。
ai le zhong nian,哀乐中年,1949,The Tragic Middle-aged,Wenhua Film Company,B&W,Added on 26/Apr/2023,桑弧,桑弧,石挥 / 王万恩 / 刘小沪 / 徐伟杰 / 崔超明 / 沈丽 / 路珊 / 莫愁 / 钱楚材 / 胡德龙 / 姚思诚 / 韩非 / 马斐 / 李浩 / 李婉青 / 胡小琴 / 顾慕如 / 余仲英 / 伊斯兰 / 沈扬 / 朱嘉琛 / 田恺 / 叶明 / 林榛 / 葛梅强 / 田振东 / 程之 / 周瑞德 / 于复瑛,黄贻钧 (音乐) / 黄绍芬 (摄影) / 马林发 (技术顾问) / 张锡龄 (技术顾问) / 郭良 (技术顾问) / 徐志良 (技术顾问) / 许琦 (剪辑) / 张伟秋 (道具) / 王月白 (布景) / 牛汉诚 (美术) / 戚秋鸣 (服装) / 程之 (化妆) / 倪亦非 (化妆) / 吴剑晃 (剧务) / 徐进 (剧务) / 沈轶民 (录音) / 毛根 (技术顾问) / 王洁 (场记) / 许荷香 (洗印) / 杜振昆 (洗印),陈绍常创办小学多年，自任校长。其妻英年早逝，留下三个孩子赖他照料 。别人每每劝他续弦，但他目睹挚友刘之权的女儿敏华备受后母虐待之苦，便打消了续娶之念。后来，刘之权全家迁居外地，多年音讯杳然。某日，敏华突然前来叩见，谋求职业。绍常同情她的遭遇，便留她在校任教。此时，绍常的孩子也都成人。长子建 中在一家银行供职，与银行经理的女儿结婚，社会地位也日益提高。他力劝绍常退休，在家颐养晚年。绍常被勉强说服而向学校提出辞呈，并推荐敏华继任校长。建中为了表示支持，恳请岳父捐款给学校并担任学校的董事长。绍常赋闲在家，孩子们成家后，与他往来日疏。只有敏华，为了工作常来和他谈心，她深知他的事业心很强，生命力也还旺盛，应该工作。经敏华热情、诚挚的邀请，绍常又回到学校。不久，学校里一个同事托他向敏华求婚，他忽然感到一种异样的心情，开始觉察到自己已爱上敏华。同时，他发现敏华也一直爱着他。于是，他告诉建中，自己准备结婚，却遭到建中与家里所有人的坚决反对。 建中并宣称，他代表岳父以学校董事长的名义，将敏华撤职。绍常为维护他和敏华的感情，也毅然离开学校。他俩结婚后，共同创办另一所小学。 在新学校开学之日，也正是敏华的婴儿呱呱坠地之时，他们都感到“生命无处不在”的喜悦。
can dong,残冬,1949,End of Winter,Guotai Film Company,B&W,Added on 26/Apr/2023,杨小仲,包蕾,束夷 / 苏曼意 / 温锡莹 / 凌之浩 / 莫愁 / 凌云 / 马骥 / 房珊 / 杨志卿 / 周伯勋 / 周起,柳中浩 (监制) / 周伯勋 (制片主任) / 陶由 (副导演) / 周诗穆 (摄影) / 谈鹤鸣 (录音) / 童玉庭 (布景) / 黄贻钧 (音乐) / 许明 (剪辑) / 严兆德 (洗印) / 杭子玉 (洗印) / 李思慎 (剧务) / 马爱珍 (场记) / 许垦 (化妆) / 崔元良 (场务) / 何菊生 (道具) / 葛宾甫 (服装) / 章庄华 (布景) / 张瑞庆 (美术),萧宝莲是个可怜的孩子，因家境贫寒，在旧邻居王曼玲的介绍下当了舞女，并很快红了起来，但仍摆脱不了“干妈”薛如云和流氓徐尤耕的控制与压迫。她爱上了叶复清，宝莲想借此摆脱她的伴舞生涯。可叶复清却是个口是心非的无赖，和另一个富家小姐订了婚，宝莲的愿望落了空。后来，宝莲受了刺激，不幸又中了富商严仲甫的圈套，被迫做了他的姨太太。一次，宝莲与叶复清又一次重逢，在他的花言巧语下，软弱的宝莲再次被欺骗。当她和叶某约会时，被严仲甫发现，严仲甫一顿毒打将她赶出了家门。无奈之下，宝莲只好再次下海，历经种种磨难，却仍逃不脱魔掌。在残冬的日子里，姐妹们告诉她年头就要变了，宝莲心里默默祈祷着，希望春天快点到来……
die hai xiong feng,谍海雄风,1949,A Heroic Spy,中联影业公司 (Hong Kong),B&W,Added on 26/Apr/2023,陈翼青,顾梦鹤,白光 / 张翼 / 梅熹 / 韩兰根 / 关宏达 / 殷秀岑 / 洪警铃 / 张琬 / 杨志卿 / 章志直 / 顾梦鹤 / 金奇 / 尔群 / 陈雷 / 杨诚 / 冯奇 / 柳影 / 尚华 / 吴树鸿 / 朱云山 / 希若 / 姚亚影 / 范锦华,薛伯青 (摄影) / 薛岱云 (摄影助理) / 严玉良 (录音) / 吴家骅 (录音助理) / 仲慰 (布景) / 黎锦光 (音乐) / 张英 (作词) / 刘甦 (作曲) / 许荷香 (洗印) / 杜振昆 (洗印) / 韦纯葆 (剪辑) / 陈雷 (剧务) / 予恕 (场记) / 吴瑞林 (场务) / 曲延椿 (场务) / 何菊生 (道具) / 范锦华 (化妆) / 何子英 (服装),抗战期间，国民党特工王无畏、王士雄等人在北方完成了秘密工作，奉命乘船返回上海，无畏意外地见到了恋人交际花洪明娟。船上有大批准备援助驻沪日军的物资，士雄等果断将船炸毁，并逃上了救生艇，途中将洪明娟救起，后搭上了一艘货船。包船的李某与洪明娟同是敌伪间谍，二人正在密谈，士雄等闯入。为掩护自己，洪明娟将李某击毙。到上海后无畏不顾士雄的警告与洪明娟同居，最终选择了自杀，临终前将一份密件交与洪明娟，嘱其立即焚毁……
huang yuan yan ji,荒园艳迹,1949,Murder in an Abandoned Garden,Guotai Film Company,B&W,Added on 26/Apr/2023,杨小仲,张彻,蓝天虹 / 吴惊鸿 / 杨志卿 / 张琬 / 阳华 / 徐垦 / 高扬 / 陈云华,柳中浩 (监制) / 徐欣夫 (制片主任),大陆戏院当家台柱冷云是戏院经理齐克安的养女，其生母林白燕十八年前也曾是戏院台柱，但冷云并不知情。克安之子齐冲与冷云从小青梅竹马，感情深厚。中年男子贾葆真对冷云十分痴迷，一次将冷云骗到公寓意图非礼，冷云拼命逃脱。次日贾葆真被人刺死在公寓，现场发现一封恐吓信，信中提到了冷云，地上还有一支刻有冷云名字的钢笔。冷云遂被警察作为嫌犯逮捕。齐冲不愿冷云受苦，到警局投案，自认凶手。而冷云在回家后的第二天突然失踪……
ji fan feng yu,几番风雨,1949,Setbacks in Their Life,Datong Film Company,B&W,Added on 26/Apr/2023,何兆璋,洪深 / 赵清阁,严碧丽 / 唐葭村 / 林默予 / 朱琳 / 范来 / 葛梅强 / 关嘉丽 / 束夷 / 韩涛 / 梁明 / 史原 / 周刍 / 于冲 / 夏冬 / 宏霞 / 华重山 / 曹龄青 / 强明 / 丁惟明 / 高博 / 曼萍 / 罗静宜 / 张瞳 / 朱云山,柳中浩 (监制) / 张石川 (制片) / 罗从周 (摄影) / 王玉如 (摄影) / 袁庆余 (录音) / 姚守清 (录音) / 董萍 (布景) / 黄贻钧 (音乐) / 王梦石 (化妆) / 陈瑞和 (剪辑) / 赵家树 (剪辑) / 严兆德 (洗印) / 杭子玉 (洗印) / 萧寿生 (洗印) / 夏冬 (剧务) / 金鹤良 (服装) / 何品芳 (道具) / 薛根宝 (陈设) / 徐应生 (场务),抗战时期，江有恒一家住在上海一隅，江家有三个女儿：大女儿淑珍嫁给中学教员刘明轩，婚后一直寄居娘家，长年劳累，却安命自如；二女儿霭珍，抱独身主义，就职于一家公司，早出晚归，悠然自得；三女儿惠珍，浪漫成性，爱慕虚荣，与某洋行方经理同居，但在父母家仍占一室。刘明轩患肺病，夜间咳嗽更烈，恐影响孩子安睡淑珍怂恿丈夫到三妹的房间借宿。因事先未征得三妹同意，从而引起一场争吵，三妹对姐夫颇多奚落，淑珍只好暗自流泪。 　惠珍在家逞强，在外却备受欺凌。方经理又与陈小姐厮混，她在一气之下，也与过去曾经相爱的画家来往。方经理即据此将她逐出家门。方经理的亲信小荆乘隙向惠珍进攻，既诈骗她的钱财，又企图占有她的身体，惠珍愤极，将小荆骗至山坡公路旁，灌醉后推他坠崖而死，自己也驾车撞山而亡。霭珍穷于应付几位追求者的纠缠，但对其中一位记者李青山却有好感，当他正式想她表白时，却又婉言拒绝。李青山怏怏回到江西老家，由父母作主，与另一女子成婚。后又来信，请霭珍前去合办儿童乐园。她告别父母与大姐、姐夫，踏上了新的人生征途。
li ren xing,丽人行,1949,A March of Beauties,Kunlun Film Company,B&W,Added on 26/Apr/2023,陈鲤庭,田汉,上官云珠 / 周峰 / 高重宝 / 黄宗英 / 蓝马 / 沙莉 / 马宗英 / 王苹 / 张翼 / 刘小沪 / 赵丹 / 田广才 / 王杰 / 孟浪 / 石炎 / 方平 / 阮斐 / 林秋 / 刘碧堂 / 周星 / 王静安 / 许秉铎 / 严恭 / 费克 / 程漠 / 周泓 / 方维丽 / 谭震 / 王为一 / 夏天 / 傅伯棠,任宗德 (制片) / 赵明 (副导演) / 吴蔚云 (技术顾问) / 韩仲良 (摄影) / 沈喜林 (摄影助理) / 孙良录 (录音) / 张福宝 (录音) / 华耀祖 (录音助理) / 陆奇生 (灯光) / 叶苗 (布景) / 牛葆荣 (布景助理) / 徐子诚 (美术) / 诸富祥 (布景设计) / 王云阶 (音乐) / 丁伯和 (配音) / 辛汉文 (造型设计) / 石炎 (剧务) / 孟远 (场记) / 张普人 (场务) / 姚志荣 (道具) / 曹明 (服装) / 姚永福 (化妆) / 邬廷芳 (剪辑) / 傅正义 (剪辑) / 吴增荣 (洗印) / 周教大 (洗印) / 徐而泉 (洗印) / 裘葛 (摄影),1944年，沦陷的上海。女工金妹放工回家途中，遭日军强暴，痛不欲生。刘大哥、孟南和李新群将金妹救至友人梁若英家中。若英因丈夫章玉良赴内地参加抗战，不耐贫困和寂寞，又嫁与银行家王仲原，但又对王的亲日态度感到不安。一日，若英收到玉良来信，言其已来上海，欲见爱女贝贝，相约在孟南、新群家晤面。若英如约前往，与玉良谈话间，日军密探突至，误认他俩为孟南、新群而捕去。孟南迅即离开上海。金妹受辱后，又遭厂方解雇，丈夫友生也被流氓殴打而双目失明。金妹为维持生活及替丈夫治疗，被迫为娼。玉良、若英因没有罪证被释，玉良继续从事地下抗日活动，若英贪恋物质享受，仍然与王仲原生活。王接受日军指使，成立“东亚出版社”，刘大哥、玉良、新群与之斗争。若英发现王另有外遇，继而察觉王的卖国行径，不禁悔恨交集。此时玉良为避敌人追捕，已携贝贝离沪。若英深感无脸见人，遗书新群，来到江边，无意中发现金妹。原来金妹因不堪凌辱及丈夫误解，投江被救。若英弃绝死念，在新群的帮助下，和金妹一起踏上新的征途。
mu qin (1949),母亲,1949,Mother,Wenhua Film Company,B&W,Added on 26/Apr/2023; Same title with a 1956 film,石挥,石挥,秦怡 / 沈扬 / 王龙基 / 崔超明 / 杜丽珠 / 吕媚莲 / 周小朋 / 林榛 / 田振东 / 江山 / 余仲英 / 孟树范 / 苏曼 / 李敏珠 / 李盛左 / 耿震 / 张翚 / 黎频 / 莫愁 / 田太宣 / 卫禹平 / 程之 / 胡小菡 / 何学初 / 童葆苓 / 华臣 / 伊斯兰 / 方伯,叶明 (副导演) / 葛伟卿 (摄影) / 马林发 (摄影助理) / 朱伟刚 (录音) / 毛根 (录音助理) / 郭良 (录音助理) / 李恩杰 (布景) / 王云阶 (音乐) / 许明 (剪辑) / 傅继秋 (剪辑) / 杜振昆 (洗印) / 许荷香 (洗印) / 徐进 (剧务) / 王洁 (场记) / 程之 (化妆) / 戚秋鸣 (服装) / 张伟秋 (道具) / 牛汉城 (美术),陈素贞生有一子一女，儿名牛牛，女名贝贝。其夫终日沉溺声色，两个交际花为他争风吃醋，其中一个有后台的将他告上法庭，他输了官司又破了产，落得个投水自尽的下场。素珍带着孩子从祖传大宅迁入陋巷，为了生计素珍找了份家庭老师的工作，男主人何志远竟是她的老同学。志远新近丧妻，与素珍的偶遇使他又有了生活的热情。志远不久向素珍求婚，贝贝却在此时重病夭折。素珍自责没有照顾好女儿而拒绝了志远，从此节衣缩食供牛牛上学……
qing shan cui gu,青山翠谷,1949,The Green Valley,中央电影摄影场二厂,B&W,Added on 26/Apr/2023,岳枫,包蕾,罗兰 / 关宏达 / 戴耘 / 张鸿眉 / 卫禹平 / 蒋幼安 / 何学初 / 王路西 / 袁立风 / 岳路 / 顾梦鹤 / 李保罗 / 王骏,罗学濂 (监制) / 徐苏灵 (制片) / 石凤岐 (摄影) / 金学琴 (剪辑) / 翁世涛 (布景) / 庄凯庐 (道具) / 陆伯勤 (服装) / 薛志昌 (录音),地主刘大爷的儿子刘大痴又傻又哑，不慎落水里被佃户林大雄所救。霸道苛刻的刘大爷准备赏大雄一块银元了事，其继室却看中了大雄的健壮英俊，定要大雄在家中做长工。大雄与佃户庄老爹的女儿小娟相爱，小娟之兄大牛与刘家管家胡二爷之子小胡有过磨擦，胡二爷因此怀恨在心。胡二爷欲捉大牛去做修城的民夫，大牛闻信逃走，庄老爹却被抓进庄中地牢。小娟去求刘大爷，杨氏发现了大雄与小娟的恋情，便让刘大爷将小娟嫁给大痴。大雄此时亦被小胡诬陷为闹事者，为救大雄，小娟只得答应嫁给大痴……
sha ren ye,杀人夜,1949,A Murderous Night,新时代影业公司 (Hong Kong),B&W,Added on 26/Apr/2023,岳枫,杨甦,白光 / 严俊 / 韩涛 / 周起 / 王珏 / 井淼 / 殷秀岑 / 梅村 / 朱江,严克俊 (监制) / 严勤甫 (制片) / 胡杰 (副导演),心理学教授杨克心时常与在警局工作的好友赵宗奋在一沙龙聚会。沙龙边上有一照相馆，橱窗里贴了几张某女郎的照片，杨克心对女郎十分倾心。一晚杨克心与相片上的女郎偶遇，女郎恳请他送自己回家。女郎名叫李静怡，是流氓头子方温桥的情妇。二人交谈十分开心，一见如故，不料方温桥突然进来，打斗中杨克心摸到一把剪刀，竟将方当场刺死。杨克心准备自首，李静怡拦住了他，二人最终决定毁尸灭迹。方的保镖殷建偶然得知真相，开始对杨克心进行巨额勒索……
shi san hao nv dao,十三号女盗,1949,Female Thief No. 13,启华影片公司 (Hong Kong),B&W,Added on 26/Apr/2023; Also known as 《还我清白》,屠光启,屠光启,欧阳莎菲 / 吕玉堃 / 陈云华 / 杨志卿 / 刘小沪 / 姜修 / 屠光启,陈震祥 (摄影),孤苦无助的施凤莲为了安葬父母借了应飞的印子钱，由于无力偿还，只得听从应飞摆布做了名女盗，三年前的一天在作案时被捕后入狱。三年过去，重获自由的凤莲决心好好做人，更让她兴奋的是认识了青年教师张家浩，让她重新体会了善良与温情。警官张家冷坚决反对弟弟家浩与女盗交往，为了不玷污家浩的清白，凤莲只得离开家浩，到王家做保姆，没想到在那里又碰到了做家庭老师的家浩，重逢使二人坚定了共同争取幸福的决心。而此时，应飞盯上了王家的祖传玉玺……
shuang qiang nv xia,双枪女侠,1949,The Double-gun Heroine,华星影业公司 (Hong Kong),B&W,Added on 26/Apr/2023,吴文超,叶逸芳,华香琳 / 王曼娜 / 韩兰根 / 关宏达 / 于素秋 / 严肃 / 岳麟 / 章志直 / 殷秀岑,陈震祥 (摄影),仗势欺人的谭海天是林将军的参谋，糊涂的林将军却将其视为亲信。谭海天欲强奸女伶白珊瑚，被双枪女侠阻止，并令其不得再打白的主意。谭海天气恼之下将白介绍给林将军，林将军见白貌美便将其留在府中。林将军之女林飞燕前去劝阻，父女二人发生了激烈的争吵。名角碧云天是白的表兄，二人从小青梅竹马。林将军请碧云天到府中演出，碧云天与白得以暗中相会，不料被谭海天窥见。谭借此要挟，白依然不从，谭便在林将军面前大进谗言，白、碧被关进石屋。
